[
    {
        "title": "Millors moments (temporada 1, setmana 1)",
        "urlArxiu": "https://audios.3catvideos.cat/multimedia/mp3/1/4/1599239459641.mp3",
        "urlPagina": "https://www.3cat.cat/3cat/millors-moments-setmana-1/audio/1078022/",
        "temporada": 1,
        "setmana": 1,
        "mida": 24865018,
        "durada_text": "00:51:48",
        "durada_ms": 3108000,
        "data_text": "04/09/2020 22:00",
        "data": "2020-09-04T22:00:00+02:00"
    },
    {
        "title": "Millors moments (temporada 1, setmana 2)",
        "urlArxiu": "https://audios.3catvideos.cat/multimedia/mp3/6/6/1599827439966.mp3",
        "urlPagina": "https://www.3cat.cat/3cat/millors-moments-setmana-2/audio/1078503/",
        "temporada": 1,
        "setmana": 2,
        "mida": 25515154,
        "durada_text": "00:53:09",
        "durada_ms": 3189000,
        "data_text": "11/09/2020 22:00",
        "data": "2020-09-11T22:00:00+02:00"
    },
    {
        "title": "Millors moments (temporada 1, setmana 3)",
        "urlArxiu": "https://audios.3catvideos.cat/multimedia/mp3/7/0/1600440948207.mp3",
        "urlPagina": "https://www.3cat.cat/3cat/millors-moments-setmana-3/audio/1079115/",
        "temporada": 1,
        "setmana": 3,
        "mida": 25012349,
        "durada_text": "00:52:06",
        "durada_ms": 3126000,
        "data_text": "18/09/2020 22:05",
        "data": "2020-09-18T22:05:00+02:00"
    },
    {
        "title": "Millors moments (temporada 1, setmana 4)",
        "urlArxiu": "https://audios.3catvideos.cat/multimedia/mp3/7/4/1601040346047.mp3",
        "urlPagina": "https://www.3cat.cat/3cat/millors-moments-setmana-4/audio/1079717/",
        "temporada": 1,
        "setmana": 4,
        "mida": 25185593,
        "durada_text": "00:52:28",
        "durada_ms": 3148000,
        "data_text": "25/09/2020 22:06",
        "data": "2020-09-25T22:06:00+02:00"
    },
    {
        "title": "Millors moments (temporada 1, setmana 5)",
        "urlArxiu": "https://audios.3catvideos.cat/multimedia/mp3/4/9/1601890253094.mp3",
        "urlPagina": "https://www.3cat.cat/3cat/millors-moments-setmana-5/audio/1080545/",
        "temporada": 1,
        "setmana": 5,
        "mida": 25055608,
        "durada_text": "00:52:11",
        "durada_ms": 3131000,
        "data_text": "02/10/2020 22:00",
        "data": "2020-10-02T22:00:00+02:00"
    },
    {
        "title": "Millors moments (temporada 1, setmana 6)",
        "urlArxiu": "https://audios.3catvideos.cat/multimedia/mp3/4/2/1602236447724.mp3",
        "urlPagina": "https://www.3cat.cat/3cat/millors-moments-setmana-6/audio/1081009/",
        "temporada": 1,
        "setmana": 6,
        "mida": 25270648,
        "durada_text": "00:52:38",
        "durada_ms": 3158000,
        "data_text": "09/10/2020 22:00",
        "data": "2020-10-09T22:00:00+02:00"
    },
    {
        "title": "Millors moments (temporada 1, setmana 7)",
        "urlArxiu": "https://audios.3catvideos.cat/multimedia/mp3/8/4/1602847525348.mp3",
        "urlPagina": "https://www.3cat.cat/3cat/millors-moments-setmana-7/audio/1081655/",
        "temporada": 1,
        "setmana": 7,
        "mida": 25241182,
        "durada_text": "00:52:35",
        "durada_ms": 3155000,
        "data_text": "16/10/2020 22:05",
        "data": "2020-10-16T22:05:00+02:00"
    },
    {
        "title": "Millors moments (temporada 1, setmana 8)",
        "urlArxiu": "https://audios.3catvideos.cat/multimedia/mp3/8/5/1605093956758.mp3",
        "urlPagina": "https://www.3cat.cat/3cat/millors-moments-setmana-8/audio/1084196/",
        "temporada": 1,
        "setmana": 8,
        "mida": 25070027,
        "durada_text": "00:52:13",
        "durada_ms": 3133000,
        "data_text": "23/10/2020 22:00",
        "data": "2020-10-23T22:00:00+02:00"
    },
    {
        "title": "Millors moments (temporada 1, setmana 9)",
        "urlArxiu": "https://audios.3catvideos.cat/multimedia/mp3/5/3/1604072775935.mp3",
        "urlPagina": "https://www.3cat.cat/3cat/millors-moments-setmana-9/audio/1083052/",
        "temporada": 1,
        "setmana": 9,
        "mida": 25324564,
        "durada_text": "00:52:45",
        "durada_ms": 3165000,
        "data_text": "30/10/2020 22:05",
        "data": "2020-10-30T22:05:00+01:00"
    },
    {
        "title": "Millors moments (temporada 1, setmana 10)",
        "urlArxiu": "https://audios.3catvideos.cat/multimedia/mp3/6/4/1604684447146.mp3",
        "urlPagina": "https://www.3cat.cat/3cat/millors-moments-setmana-10/audio/1083793/",
        "temporada": 1,
        "setmana": 10,
        "mida": 25251631,
        "durada_text": "00:52:36",
        "durada_ms": 3156000,
        "data_text": "06/11/2020 22:05",
        "data": "2020-11-06T22:05:00+01:00"
    },
    {
        "title": "Millors moments (temporada 1, setmana 11)",
        "urlArxiu": "https://audios.3catvideos.cat/multimedia/mp3/8/0/1605290141308.mp3",
        "urlPagina": "https://www.3cat.cat/3cat/millors-moments-setmana-11/audio/1084496/",
        "temporada": 1,
        "setmana": 11,
        "mida": 25101583,
        "durada_text": "00:52:17",
        "durada_ms": 3137000,
        "data_text": "13/11/2020 22:05",
        "data": "2020-11-13T22:05:00+01:00"
    },
    {
        "title": "Millors moments (temporada 1, setmana 12)",
        "urlArxiu": "https://audios.3catvideos.cat/multimedia/mp3/8/1/1605884159018.mp3",
        "urlPagina": "https://www.3cat.cat/3cat/millors-moments-setmana-12/audio/1085163/",
        "temporada": 1,
        "setmana": 12,
        "mida": 25150693,
        "durada_text": "00:52:23",
        "durada_ms": 3143000,
        "data_text": "20/11/2020 22:00",
        "data": "2020-11-20T22:00:00+01:00"
    },
    {
        "title": "Millors moments (temporada 1, setmana 13)",
        "urlArxiu": "https://audios.3catvideos.cat/multimedia/mp3/9/0/1606477532909.mp3",
        "urlPagina": "https://www.3cat.cat/3cat/millors-moments-setmana-13/audio/1085823/",
        "temporada": 1,
        "setmana": 13,
        "mida": 26501746,
        "durada_text": "00:55:12",
        "durada_ms": 3312000,
        "data_text": "27/11/2020 22:00",
        "data": "2020-11-27T22:00:00+01:00"
    },
    {
        "title": "Millors moments (temporada 1, setmana 14)",
        "urlArxiu": "https://audios.3catvideos.cat/multimedia/mp3/6/4/1607088314946.mp3",
        "urlPagina": "https://www.3cat.cat/3cat/millors-moments-setmana-14/audio/1086543/",
        "temporada": 1,
        "setmana": 14,
        "mida": 26892329,
        "durada_text": "00:56:01",
        "durada_ms": 3361000,
        "data_text": "04/12/2020 22:00",
        "data": "2020-12-04T22:00:00+01:00"
    },
    {
        "title": "Millors moments (temporada 1, setmana 15)",
        "urlArxiu": "https://audios.3catvideos.cat/multimedia/mp3/8/4/1607971821348.mp3",
        "urlPagina": "https://www.3cat.cat/3cat/millors-moments-setmana-15/audio/1087398/",
        "temporada": 1,
        "setmana": 15,
        "mida": 25292173,
        "durada_text": "00:52:41",
        "durada_ms": 3161000,
        "data_text": "11/12/2020 22:00",
        "data": "2020-12-11T22:00:00+01:00"
    },
    {
        "title": "Millors moments (temporada 1, setmana 16)",
        "urlArxiu": "https://audios.3catvideos.cat/multimedia/mp3/1/5/1608318668151.mp3",
        "urlPagina": "https://www.3cat.cat/3cat/millors-moments-setmana-16/audio/1087914/",
        "temporada": 1,
        "setmana": 16,
        "mida": 24971598,
        "durada_text": "00:52:01",
        "durada_ms": 3121000,
        "data_text": "18/12/2020 22:00",
        "data": "2020-12-18T22:00:00+01:00"
    },
    {
        "title": "Millors moments (temporada 1, setmana 17)",
        "urlArxiu": "https://audios.3catvideos.cat/multimedia/mp3/2/9/1609415416792.mp3",
        "urlPagina": "https://www.3cat.cat/3cat/millors-moments-setmana-17/audio/1088839/",
        "temporada": 1,
        "setmana": 17,
        "mida": 25201684,
        "durada_text": "00:52:30",
        "durada_ms": 3150000,
        "data_text": "25/12/2020 22:00",
        "data": "2020-12-25T22:00:00+01:00"
    },
    {
        "title": "Millors moments (temporada 1, setmana 24)",
        "urlArxiu": "https://audios.3catvideos.cat/multimedia/mp3/7/6/1613141447567.mp3",
        "urlPagina": "https://www.3cat.cat/3cat/millors-moments-setmana-24/audio/1092578/",
        "temporada": 1,
        "setmana": 24,
        "mida": 25004617,
        "durada_text": "00:52:05",
        "durada_ms": 3125000,
        "data_text": "12/02/2021 22:00",
        "data": "2021-02-12T22:00:00+01:00"
    },
    {
        "title": "Millors moments (temporada 1, setmana 26)",
        "urlArxiu": "https://audios.3catvideos.cat/multimedia/mp3/3/3/1614340255433.mp3",
        "urlPagina": "https://www.3cat.cat/3cat/millors-moments-setmana-26/audio/1093930/",
        "temporada": 1,
        "setmana": 26,
        "mida": 24565133,
        "durada_text": "00:51:10",
        "durada_ms": 3070000,
        "data_text": "26/02/2021 22:00",
        "data": "2021-02-26T22:00:00+01:00"
    },
    {
        "title": "Millors moments (temporada 1, setmana 29)",
        "urlArxiu": "https://audios.3catvideos.cat/multimedia/mp3/4/8/1616167554684.mp3",
        "urlPagina": "https://www.3cat.cat/3cat/millors-moments-setmana-29/audio/1096095/",
        "temporada": 1,
        "setmana": 29,
        "mida": 24790204,
        "durada_text": "00:51:38",
        "durada_ms": 3098000,
        "data_text": "19/03/2021 22:00",
        "data": "2021-03-19T22:00:00+01:00"
    },
    {
        "title": "Millors moments (temporada 1, setmana 30)",
        "urlArxiu": "https://audios.3catvideos.cat/multimedia/mp3/3/7/1616779237673.mp3",
        "urlPagina": "https://www.3cat.cat/3cat/millors-moments-setmana-30/audio/1096845/",
        "temporada": 1,
        "setmana": 30,
        "mida": 24940042,
        "durada_text": "00:51:57",
        "durada_ms": 3117000,
        "data_text": "26/03/2021 22:00",
        "data": "2021-03-26T22:00:00+01:00"
    },
    {
        "title": "Millors moments (temporada 1, setmana 31)",
        "urlArxiu": "https://audios.3catvideos.cat/multimedia/mp3/1/3/1617291956631.mp3",
        "urlPagina": "https://www.3cat.cat/3cat/millors-moments-setmana-31/audio/1097415/",
        "temporada": 1,
        "setmana": 31,
        "mida": 24932728,
        "durada_text": "00:51:56",
        "durada_ms": 3116000,
        "data_text": "02/04/2021 22:00",
        "data": "2021-04-02T22:00:00+02:00"
    },
    {
        "title": "Millors moments (temporada 1, setmana 32)",
        "urlArxiu": "https://audios.3catvideos.cat/multimedia/mp3/8/8/1617966021988.mp3",
        "urlPagina": "https://www.3cat.cat/3cat/millors-moments-setmana-32/audio/1098008/",
        "temporada": 1,
        "setmana": 32,
        "mida": 25103673,
        "durada_text": "00:52:17",
        "durada_ms": 3137000,
        "data_text": "09/04/2021 22:00",
        "data": "2021-04-09T22:00:00+02:00"
    },
    {
        "title": "Millors moments (temporada 1, setmana 33)",
        "urlArxiu": "https://audios.3catvideos.cat/multimedia/mp3/0/9/1618571143490.mp3",
        "urlPagina": "https://www.3cat.cat/3cat/millors-moments-setmana-33/audio/1098674/",
        "temporada": 1,
        "setmana": 33,
        "mida": 100518144,
        "durada_text": "00:52:21",
        "durada_ms": 3141000,
        "data_text": "16/04/2021 22:00",
        "data": "2021-04-16T22:00:00+02:00"
    },
    {
        "title": "Millors moments (temporada 1, setmana 34)",
        "urlArxiu": "https://audios.3catvideos.cat/multimedia/mp3/7/0/1619166359207.mp3",
        "urlPagina": "https://www.3cat.cat/3cat/millors-moments-setmana-34/audio/1099360/",
        "temporada": 1,
        "setmana": 34,
        "mida": 98929920,
        "durada_text": "00:51:31",
        "durada_ms": 3091000,
        "data_text": "23/04/2021 22:00",
        "data": "2021-04-23T22:00:00+02:00"
    },
    {
        "title": "Millors moments (temporada 1, setmana 35)",
        "urlArxiu": "https://audios.3catvideos.cat/multimedia/mp3/1/7/1619782271371.mp3",
        "urlPagina": "https://www.3cat.cat/3cat/millors-moments-setmana-35/audio/1100102/",
        "temporada": 1,
        "setmana": 35,
        "mida": 99917568,
        "durada_text": "00:52:02",
        "durada_ms": 3122000,
        "data_text": "30/04/2021 22:00",
        "data": "2021-04-30T22:00:00+02:00"
    },
    {
        "title": "Millors moments (temporada 1, setmana 36)",
        "urlArxiu": "https://audios.3catvideos.cat/multimedia/mp3/9/0/1620384335509.mp3",
        "urlPagina": "https://www.3cat.cat/3cat/millors-moments-setmana-36/audio/1100801/",
        "temporada": 1,
        "setmana": 36,
        "mida": 100641792,
        "durada_text": "00:52:25",
        "durada_ms": 3145000,
        "data_text": "07/05/2021 22:00",
        "data": "2021-05-07T22:00:00+02:00"
    },
    {
        "title": "Millors moments (temporada 1, setmana 37)",
        "urlArxiu": "https://audios.3catvideos.cat/multimedia/mp3/1/2/1620819929821.mp3",
        "urlPagina": "https://www.3cat.cat/3cat/millors-moments-setmana-37/audio/1101237/",
        "temporada": 1,
        "setmana": 37,
        "mida": 100200960,
        "durada_text": "00:52:11",
        "durada_ms": 3131000,
        "data_text": "14/05/2021 22:00",
        "data": "2021-05-14T22:00:00+02:00"
    },
    {
        "title": "Millors moments (temporada 1, setmana 38)",
        "urlArxiu": "https://audios.3catvideos.cat/multimedia/mp3/4/1/1621592423214.mp3",
        "urlPagina": "https://www.3cat.cat/3cat/millors-moments-setmana-38/audio/1102164/",
        "temporada": 1,
        "setmana": 38,
        "mida": 100333824,
        "durada_text": "00:52:15",
        "durada_ms": 3135000,
        "data_text": "21/05/2021 22:00",
        "data": "2021-05-21T22:00:00+02:00"
    },
    {
        "title": "Millors moments (temporada 1, setmana 39)",
        "urlArxiu": "https://audios.3catvideos.cat/multimedia/mp3/9/7/1622024737879.mp3",
        "urlPagina": "https://www.3cat.cat/3cat/millors-moments-setmana-39/audio/1102593/",
        "temporada": 1,
        "setmana": 39,
        "mida": 100974336,
        "durada_text": "00:52:35",
        "durada_ms": 3155000,
        "data_text": "28/05/2021 22:00",
        "data": "2021-05-28T22:00:00+02:00"
    },
    {
        "title": "Millors moments (temporada 1, setmana 40)",
        "urlArxiu": "https://audios.3catvideos.cat/multimedia/mp3/4/1/1622804471114.mp3",
        "urlPagina": "https://www.3cat.cat/3cat/millors-moments-setmana-40/audio/1103557/",
        "temporada": 1,
        "setmana": 40,
        "mida": 100416768,
        "durada_text": "00:52:18",
        "durada_ms": 3138000,
        "data_text": "04/06/2021 22:00",
        "data": "2021-06-04T22:00:00+02:00"
    },
    {
        "title": "Millors moments (temporada 1, setmana 41)",
        "urlArxiu": "https://audios.3catvideos.cat/multimedia/mp3/3/3/1623408037533.mp3",
        "urlPagina": "https://www.3cat.cat/3cat/millors-moments-setmana-41/audio/1104244/",
        "temporada": 1,
        "setmana": 41,
        "mida": 50094915,
        "durada_text": "00:52:10",
        "durada_ms": 3130000,
        "data_text": "11/06/2021 22:00",
        "data": "2021-06-11T22:00:00+02:00"
    },
    {
        "title": "Millors moments (temporada 1, setmana 42)",
        "urlArxiu": "https://audios.3catvideos.cat/multimedia/mp3/3/6/1624010745263.mp3",
        "urlPagina": "https://www.3cat.cat/3cat/millors-moments-setmana-42/audio/1104923/",
        "temporada": 1,
        "setmana": 42,
        "mida": 50254994,
        "durada_text": "00:52:20",
        "durada_ms": 3140000,
        "data_text": "18/06/2021 22:00",
        "data": "2021-06-18T22:00:00+02:00"
    },
    {
        "title": "Millors moments (temporada 1, setmana 43)",
        "urlArxiu": "https://audios.3catvideos.cat/multimedia/mp3/5/9/1624440032495.mp3",
        "urlPagina": "https://www.3cat.cat/3cat/millors-moments-setmana-43/audio/1105355/",
        "temporada": 1,
        "setmana": 43,
        "mida": 50229498,
        "durada_text": "00:52:19",
        "durada_ms": 3139000,
        "data_text": "25/06/2021 22:00",
        "data": "2021-06-25T22:00:00+02:00"
    },
    {
        "title": "Millors moments (temporada 1, setmana 44)",
        "urlArxiu": "https://audios.3catvideos.cat/multimedia/mp3/4/1/1625220641314.mp3",
        "urlPagina": "https://www.3cat.cat/3cat/millors-moments-setmana-44/audio/1106158/",
        "temporada": 1,
        "setmana": 44,
        "mida": 50310582,
        "durada_text": "00:52:24",
        "durada_ms": 3144000,
        "data_text": "02/07/2021 22:00",
        "data": "2021-07-02T22:00:00+02:00"
    },
    {
        "title": "Millors moments (temporada 1, setmana 45)",
        "urlArxiu": "https://audios.3catvideos.cat/multimedia/mp3/5/3/1625821256635.mp3",
        "urlPagina": "https://www.3cat.cat/3cat/millors-moments-setmana-45/audio/1106755/",
        "temporada": 1,
        "setmana": 45,
        "mida": 50329391,
        "durada_text": "00:52:25",
        "durada_ms": 3145000,
        "data_text": "09/07/2021 22:00",
        "data": "2021-07-09T22:00:00+02:00"
    },
    {
        "title": "Millors moments (temporada 1, setmana 46)",
        "urlArxiu": "https://audios.3catvideos.cat/multimedia/mp3/0/1/1626437135410.mp3",
        "urlPagina": "https://www.3cat.cat/3cat/millors-moments-setmana-46/audio/1107362/",
        "temporada": 1,
        "setmana": 46,
        "mida": 50619872,
        "durada_text": "00:52:43",
        "durada_ms": 3163000,
        "data_text": "16/07/2021 22:00",
        "data": "2021-07-16T22:00:00+02:00"
    },
    {
        "title": "Millors moments (temporada 2, setmana 1)",
        "urlArxiu": "https://audios.3catvideos.cat/multimedia/mp3/4/0/1630669204804.mp3",
        "urlPagina": "https://www.3cat.cat/3cat/millors-moments-setmana-02x01/audio/1109164/",
        "temporada": 2,
        "setmana": 1,
        "mida": 53556871,
        "durada_text": "00:55:47",
        "durada_ms": 3347000,
        "data_text": "03/09/2021 22:00",
        "data": "2021-09-03T22:00:00+02:00"
    },
    {
        "title": "Millors moments (temporada 2, setmana 2)",
        "urlArxiu": "https://audios.3catvideos.cat/multimedia/mp3/0/8/1631265313880.mp3",
        "urlPagina": "https://www.3cat.cat/3cat/millors-moments-setmana-2x02/audio/1109705/",
        "temporada": 2,
        "setmana": 2,
        "mida": 53556871,
        "durada_text": "00:55:47",
        "durada_ms": 3347000,
        "data_text": "10/09/2021 22:00",
        "data": "2021-09-10T22:00:00+02:00"
    },
    {
        "title": "Millors moments (temporada 2, setmana 3)",
        "urlArxiu": "https://audios.3catvideos.cat/multimedia/mp3/6/7/1631877955276.mp3",
        "urlPagina": "https://www.3cat.cat/3cat/millors-moments-setmana-2x03/audio/1110296/",
        "temporada": 2,
        "setmana": 3,
        "mida": 53065351,
        "durada_text": "00:55:16",
        "durada_ms": 3316000,
        "data_text": "17/09/2021 22:00",
        "data": "2021-09-17T22:00:00+02:00"
    },
    {
        "title": "Millors moments (temporada 2, setmana 4)",
        "urlArxiu": "https://audios.3catvideos.cat/multimedia/mp3/6/0/1632313521306.mp3",
        "urlPagina": "https://www.3cat.cat/3cat/millors-moments-setmana-2x03/audio/1110680/",
        "temporada": 2,
        "setmana": 4,
        "mida": 60000130,
        "durada_text": "01:02:30",
        "durada_ms": 3750000,
        "data_text": "24/09/2021 22:00",
        "data": "2021-09-24T22:00:00+02:00"
    },
    {
        "title": "Millors moments (temporada 2, setmana 5)",
        "urlArxiu": "https://audios.3catvideos.cat/multimedia/mp3/0/3/1633086953730.mp3",
        "urlPagina": "https://www.3cat.cat/3cat/millors-moments-setmana-2x05/audio/1111548/",
        "temporada": 2,
        "setmana": 5,
        "mida": 53245492,
        "durada_text": "00:55:27",
        "durada_ms": 3327000,
        "data_text": "01/10/2021 22:00",
        "data": "2021-10-01T22:00:00+02:00"
    },
    {
        "title": "Millors moments (temporada 2, setmana 6)",
        "urlArxiu": "https://audios.3catvideos.cat/multimedia/mp3/8/0/1633686909908.mp3",
        "urlPagina": "https://www.3cat.cat/3cat/millors-moments-setmana-2x06/audio/1112182/",
        "temporada": 2,
        "setmana": 6,
        "mida": 53071621,
        "durada_text": "00:55:16",
        "durada_ms": 3316000,
        "data_text": "08/10/2021 22:00",
        "data": "2021-10-08T22:00:00+02:00"
    },
    {
        "title": "Millors moments (temporada 2, setmana 7)",
        "urlArxiu": "https://audios.3catvideos.cat/multimedia/mp3/3/6/1634296567663.mp3",
        "urlPagina": "https://www.3cat.cat/3cat/millors-moments-setmana-2x07/audio/1112759/",
        "temporada": 2,
        "setmana": 7,
        "mida": 53184888,
        "durada_text": "00:55:24",
        "durada_ms": 3324000,
        "data_text": "15/10/2021 22:00",
        "data": "2021-10-15T22:00:00+02:00"
    },
    {
        "title": "Millors moments (temporada 2, setmana 8)",
        "urlArxiu": "https://audios.3catvideos.cat/multimedia/mp3/3/5/1634902212453.mp3",
        "urlPagina": "https://www.3cat.cat/3cat/millors-moments-setmana-8/audio/1113383/",
        "temporada": 2,
        "setmana": 8,
        "mida": 53104640,
        "durada_text": "00:55:19",
        "durada_ms": 3319000,
        "data_text": "22/10/2021 22:00",
        "data": "2021-10-22T22:00:00+02:00"
    },
    {
        "title": "Millors moments (temporada 2, setmana 9)",
        "urlArxiu": "https://audios.3catvideos.cat/multimedia/mp3/6/1/1635502857216.mp3",
        "urlPagina": "https://www.3cat.cat/3cat/millors-moments-setmana-9/audio/1114068/",
        "temporada": 2,
        "setmana": 9,
        "mida": 52768182,
        "durada_text": "00:54:58",
        "durada_ms": 3298000,
        "data_text": "29/10/2021 22:00",
        "data": "2021-10-29T22:00:00+02:00"
    },
    {
        "title": "Millors moments (temporada 2, setmana 10)",
        "urlArxiu": "https://audios.3catvideos.cat/multimedia/mp3/7/2/1636114841427.mp3",
        "urlPagina": "https://www.3cat.cat/3cat/millors-moments-setmana-10/audio/1114790/",
        "temporada": 2,
        "setmana": 10,
        "mida": 52664529,
        "durada_text": "00:54:51",
        "durada_ms": 3291000,
        "data_text": "05/11/2021 22:00",
        "data": "2021-11-05T22:00:00+01:00"
    },
    {
        "title": "Millors moments (temporada 2, setmana 11)",
        "urlArxiu": "https://audios.3catvideos.cat/multimedia/mp3/7/5/1636714533857.mp3",
        "urlPagina": "https://www.3cat.cat/3cat/millors-moments-setmana-11/audio/1115568/",
        "temporada": 2,
        "setmana": 11,
        "mida": 53176946,
        "durada_text": "00:55:23",
        "durada_ms": 3323000,
        "data_text": "12/11/2021 22:00",
        "data": "2021-11-12T22:00:00+01:00"
    },
    {
        "title": "Millors moments (temporada 2, setmana 12)",
        "urlArxiu": "https://audios.3catvideos.cat/multimedia/mp3/3/7/1637325029473.mp3",
        "urlPagina": "https://www.3cat.cat/3cat/millors-moments-setmana-12/audio/1116374/",
        "temporada": 2,
        "setmana": 12,
        "mida": 52652826,
        "durada_text": "00:54:50",
        "durada_ms": 3290000,
        "data_text": "19/11/2021 22:00",
        "data": "2021-11-19T22:00:00+01:00"
    },
    {
        "title": "Millors moments (temporada 2, setmana 13)",
        "urlArxiu": "https://audios.3catvideos.cat/multimedia/mp3/3/2/1637936430223.mp3",
        "urlPagina": "https://www.3cat.cat/3cat/millors-moments-setmana-13/audio/1117200/",
        "temporada": 2,
        "setmana": 13,
        "mida": 53153541,
        "durada_text": "00:55:22",
        "durada_ms": 3322000,
        "data_text": "26/11/2021 22:00",
        "data": "2021-11-26T22:00:00+01:00"
    },
    {
        "title": "Millors moments (temporada 2, setmana 14)",
        "urlArxiu": "https://audios.3catvideos.cat/multimedia/mp3/6/3/1638536452536.mp3",
        "urlPagina": "https://www.3cat.cat/3cat/millors-moments-setmana-14/audio/1118017/",
        "temporada": 2,
        "setmana": 14,
        "mida": 52654080,
        "durada_text": "00:54:50",
        "durada_ms": 3290000,
        "data_text": "03/12/2021 22:00",
        "data": "2021-12-03T22:00:00+01:00"
    },
    {
        "title": "Millors moments (temporada 2, setmana 15)",
        "urlArxiu": "https://audios.3catvideos.cat/multimedia/mp3/5/7/1639131006875.mp3",
        "urlPagina": "https://www.3cat.cat/3cat/millors-moments-setmana-15/audio/1118632/",
        "temporada": 2,
        "setmana": 15,
        "mida": 52748538,
        "durada_text": "00:54:56",
        "durada_ms": 3296000,
        "data_text": "10/12/2021 22:00",
        "data": "2021-12-10T22:00:00+01:00"
    },
    {
        "title": "Millors moments (temporada 2, setmana 16)",
        "urlArxiu": "https://audios.3catvideos.cat/multimedia/mp3/0/4/1639737026040.mp3",
        "urlPagina": "https://www.3cat.cat/3cat/millors-moments-setmana-16/audio/1119461/",
        "temporada": 2,
        "setmana": 16,
        "mida": 53058246,
        "durada_text": "00:55:16",
        "durada_ms": 3316000,
        "data_text": "17/12/2021 22:00",
        "data": "2021-12-17T22:00:00+01:00"
    },
    {
        "title": "Millors moments (temporada 2, setmana 17)",
        "urlArxiu": "https://audios.3catvideos.cat/multimedia/mp3/6/0/1640179247006.mp3",
        "urlPagina": "https://www.3cat.cat/3cat/millors-moments-setmana-17/audio/1120019/",
        "temporada": 2,
        "setmana": 17,
        "mida": 53067023,
        "durada_text": "00:55:16",
        "durada_ms": 3316000,
        "data_text": "24/12/2021 22:00",
        "data": "2021-12-24T22:00:00+01:00"
    },
    {
        "title": "Millors moments (temporada 2, setmana 18)",
        "urlArxiu": "https://audios.3catvideos.cat/multimedia/mp3/5/7/1640953245775.mp3",
        "urlPagina": "https://www.3cat.cat/3cat/millors-moments-setmana-18/audio/1120882/",
        "temporada": 2,
        "setmana": 18,
        "mida": 52896914,
        "durada_text": "00:55:06",
        "durada_ms": 3306000,
        "data_text": "31/12/2021 22:00",
        "data": "2021-12-31T22:00:00+01:00"
    },
    {
        "title": "Millors moments (temporada 2, setmana 19)",
        "urlArxiu": "https://audios.3catvideos.cat/multimedia/mp3/6/1/1641300008816.mp3",
        "urlPagina": "https://www.3cat.cat/3cat/millors-moments-setmana-19/audio/1121187/",
        "temporada": 2,
        "setmana": 19,
        "mida": 52809560,
        "durada_text": "00:55:00",
        "durada_ms": 3300000,
        "data_text": "07/01/2022 22:00",
        "data": "2022-01-07T22:00:00+01:00"
    },
    {
        "title": "Millors moments (temporada 2, setmana 20)",
        "urlArxiu": "https://audios.3catvideos.cat/multimedia/mp3/7/1/1642174564017.mp3",
        "urlPagina": "https://www.3cat.cat/3cat/millors-moments-setmana-20/audio/1122259/",
        "temporada": 2,
        "setmana": 20,
        "mida": 53152287,
        "durada_text": "00:55:22",
        "durada_ms": 3322000,
        "data_text": "14/01/2022 22:00",
        "data": "2022-01-14T22:00:00+01:00"
    },
    {
        "title": "Millors moments (temporada 2, setmana 21)",
        "urlArxiu": "https://audios.3catvideos.cat/multimedia/mp3/0/6/1642760713060.mp3",
        "urlPagina": "https://www.3cat.cat/3cat/millors-moments-setmana-21/audio/1122964/",
        "temporada": 2,
        "setmana": 21,
        "mida": 53043200,
        "durada_text": "00:55:15",
        "durada_ms": 3315000,
        "data_text": "21/01/2022 22:00",
        "data": "2022-01-21T22:00:00+01:00"
    },
    {
        "title": "Millors moments (temporada 2, setmana 22)",
        "urlArxiu": "https://audios.3catvideos.cat/multimedia/mp3/8/4/1643368847348.mp3",
        "urlPagina": "https://www.3cat.cat/3cat/millors-moments-setmana-22/audio/1123791/",
        "temporada": 2,
        "setmana": 22,
        "mida": 53001404,
        "durada_text": "00:55:12",
        "durada_ms": 3312000,
        "data_text": "28/01/2022 22:00",
        "data": "2022-01-28T22:00:00+01:00"
    },
    {
        "title": "Millors moments (temporada 2, setmana 23)",
        "urlArxiu": "https://audios.3catvideos.cat/multimedia/mp3/2/5/1643970631952.mp3",
        "urlPagina": "https://www.3cat.cat/3cat/millors-moments-setmana-23/audio/1124543/",
        "temporada": 2,
        "setmana": 23,
        "mida": 53147689,
        "durada_text": "00:55:21",
        "durada_ms": 3321000,
        "data_text": "04/02/2022 22:00",
        "data": "2022-02-04T22:00:00+01:00"
    },
    {
        "title": "Millors moments (temporada 2, setmana 24)",
        "urlArxiu": "https://audios.3catvideos.cat/multimedia/mp3/5/8/1644575421685.mp3",
        "urlPagina": "https://www.3cat.cat/3cat/millors-moments-setmana-24/audio/1125336/",
        "temporada": 2,
        "setmana": 24,
        "mida": 52740179,
        "durada_text": "00:54:56",
        "durada_ms": 3296000,
        "data_text": "11/02/2022 22:30",
        "data": "2022-02-11T22:30:00+01:00"
    },
    {
        "title": "Millors moments (temporada 2, setmana 25)",
        "urlArxiu": "https://audios.3catvideos.cat/multimedia/mp3/5/7/1645189255675.mp3",
        "urlPagina": "https://www.3cat.cat/3cat/millors-moments-setmana-25/audio/1126152/",
        "temporada": 2,
        "setmana": 25,
        "mida": 53102968,
        "durada_text": "00:55:18",
        "durada_ms": 3318000,
        "data_text": "18/02/2022 22:00",
        "data": "2022-02-18T22:00:00+01:00"
    },
    {
        "title": "Millors moments (temporada 2, setmana 26)",
        "urlArxiu": "https://audios.3catvideos.cat/multimedia/mp3/0/5/1645790119550.mp3",
        "urlPagina": "https://www.3cat.cat/3cat/millors-moments-setmana-26/audio/1126920/",
        "temporada": 2,
        "setmana": 26,
        "mida": 52795768,
        "durada_text": "00:54:59",
        "durada_ms": 3299000,
        "data_text": "25/02/2022 22:00",
        "data": "2022-02-25T22:00:00+01:00"
    },
    {
        "title": "Millors moments (temporada 2, setmana 27)",
        "urlArxiu": "https://audios.3catvideos.cat/multimedia/mp3/7/7/1646398552677.mp3",
        "urlPagina": "https://www.3cat.cat/3cat/millors-moments-setmana-27/audio/1127704/",
        "temporada": 2,
        "setmana": 27,
        "mida": 53080816,
        "durada_text": "00:55:17",
        "durada_ms": 3317000,
        "data_text": "04/03/2022 22:00",
        "data": "2022-03-04T22:00:00+01:00"
    },
    {
        "title": "Millors moments (temporada 2, setmana 28)",
        "urlArxiu": "https://audios.3catvideos.cat/multimedia/mp3/6/6/1646997955366.mp3",
        "urlPagina": "https://www.3cat.cat/3cat/millors-moments-setmana-28/audio/1128448/",
        "temporada": 2,
        "setmana": 28,
        "mida": 52199758,
        "durada_text": "00:54:22",
        "durada_ms": 3262000,
        "data_text": "11/03/2022 22:00",
        "data": "2022-03-11T22:00:00+01:00"
    },
    {
        "title": "Millors moments (temporada 2, setmana 29)",
        "urlArxiu": "https://audios.3catvideos.cat/multimedia/mp3/0/7/1647601824470.mp3",
        "urlPagina": "https://www.3cat.cat/3cat/millors-moments-setmana-29/audio/1129189/",
        "temporada": 2,
        "setmana": 29,
        "mida": 53041946,
        "durada_text": "00:55:15",
        "durada_ms": 3315000,
        "data_text": "18/03/2022 22:00",
        "data": "2022-03-18T22:00:00+01:00"
    },
    {
        "title": "Millors moments (temporada 2, setmana 30)",
        "urlArxiu": "https://audios.3catvideos.cat/multimedia/mp3/3/7/1648204542473.mp3",
        "urlPagina": "https://www.3cat.cat/3cat/millors-moments-setmana-30/audio/1129942/",
        "temporada": 2,
        "setmana": 30,
        "mida": 52943307,
        "durada_text": "00:55:08",
        "durada_ms": 3308000,
        "data_text": "25/03/2022 22:00",
        "data": "2022-03-25T22:00:00+01:00"
    },
    {
        "title": "Millors moments (temporada 2, setmana 31)",
        "urlArxiu": "https://audios.3catvideos.cat/multimedia/mp3/7/0/1648809021907.mp3",
        "urlPagina": "https://www.3cat.cat/3cat/millors-moments-setmana-31/audio/1130713/",
        "temporada": 2,
        "setmana": 31,
        "mida": 53212055,
        "durada_text": "00:55:25",
        "durada_ms": 3325000,
        "data_text": "01/04/2022 22:00",
        "data": "2022-04-01T22:00:00+02:00"
    },
    {
        "title": "Millors moments (temporada 2, setmana 32)",
        "urlArxiu": "https://audios.3catvideos.cat/multimedia/mp3/8/6/1649412332668.mp3",
        "urlPagina": "https://www.3cat.cat/3cat/millors-moments-setmana-32/audio/1131491/",
        "temporada": 2,
        "setmana": 32,
        "mida": 52715937,
        "durada_text": "00:54:54",
        "durada_ms": 3294000,
        "data_text": "08/04/2022 22:00",
        "data": "2022-04-08T22:00:00+02:00"
    },
    {
        "title": "Millors moments (temporada 2, setmana 33)",
        "urlArxiu": "https://audios.3catvideos.cat/multimedia/mp3/4/7/1649859613774.mp3",
        "urlPagina": "https://www.3cat.cat/3cat/millors-moments-setmana-33/audio/1132029/",
        "temporada": 2,
        "setmana": 33,
        "mida": 52857626,
        "durada_text": "00:55:03",
        "durada_ms": 3303000,
        "data_text": "15/04/2022 22:00",
        "data": "2022-04-15T22:00:00+02:00"
    },
    {
        "title": "Millors moments (temporada 2, setmana 34)",
        "urlArxiu": "https://audios.3catvideos.cat/multimedia/mp3/6/8/1650630015286.mp3",
        "urlPagina": "https://www.3cat.cat/3cat/millors-moments-setmana-34/audio/1132895/",
        "temporada": 2,
        "setmana": 34,
        "mida": 53051977,
        "durada_text": "00:55:15",
        "durada_ms": 3315000,
        "data_text": "22/04/2022 22:00",
        "data": "2022-04-22T22:00:00+02:00"
    },
    {
        "title": "Millors moments (temporada 2, setmana 35)",
        "urlArxiu": "https://audios.3catvideos.cat/multimedia/mp3/7/2/1651224620427.mp3",
        "urlPagina": "https://www.3cat.cat/3cat/millors-moments-setmana-35/audio/1133619/",
        "temporada": 2,
        "setmana": 35,
        "mida": 52612702,
        "durada_text": "00:54:48",
        "durada_ms": 3288000,
        "data_text": "29/04/2022 22:00",
        "data": "2022-04-29T22:00:00+02:00"
    },
    {
        "title": "Millors moments (temporada 2, setmana 36)",
        "urlArxiu": "https://audios.3catvideos.cat/multimedia/mp3/2/4/1651845937042.mp3",
        "urlPagina": "https://www.3cat.cat/3cat/millors-moments-setmana-36/audio/1134423/",
        "temporada": 2,
        "setmana": 36,
        "mida": 53270569,
        "durada_text": "00:55:29",
        "durada_ms": 3329000,
        "data_text": "06/05/2022 22:00",
        "data": "2022-05-06T22:00:00+02:00"
    },
    {
        "title": "Millors moments (temporada 2, setmana 37)",
        "urlArxiu": "https://audios.3catvideos.cat/multimedia/mp3/7/7/1652436665077.mp3",
        "urlPagina": "https://www.3cat.cat/3cat/millors-moments-setmana-37/audio/1135170/",
        "temporada": 2,
        "setmana": 37,
        "mida": 53125537,
        "durada_text": "00:55:20",
        "durada_ms": 3320000,
        "data_text": "13/05/2022 22:00",
        "data": "2022-05-13T22:00:00+02:00"
    },
    {
        "title": "Millors moments (temporada 2, setmana 38)",
        "urlArxiu": "https://audios.3catvideos.cat/multimedia/mp3/6/2/1653039308026.mp3",
        "urlPagina": "https://www.3cat.cat/3cat/millors-moments-setmana-38/audio/1135939/",
        "temporada": 2,
        "setmana": 38,
        "mida": 52916140,
        "durada_text": "00:55:07",
        "durada_ms": 3307000,
        "data_text": "20/05/2022 22:00",
        "data": "2022-05-20T22:00:00+02:00"
    },
    {
        "title": "Millors moments (temporada 2, setmana 39)",
        "urlArxiu": "https://audios.3catvideos.cat/multimedia/mp3/8/8/1653653420788.mp3",
        "urlPagina": "https://www.3cat.cat/3cat/millors-moments-setmana-39/audio/1136737/",
        "temporada": 2,
        "setmana": 39,
        "mida": 53264718,
        "durada_text": "00:55:29",
        "durada_ms": 3329000,
        "data_text": "27/05/2022 22:00",
        "data": "2022-05-27T22:00:00+02:00"
    },
    {
        "title": "Millors moments (temporada 2, setmana 40)",
        "urlArxiu": "https://audios.3catvideos.cat/multimedia/mp3/6/1/1654263620516.mp3",
        "urlPagina": "https://www.3cat.cat/3cat/millors-moments-setmana-40/audio/1137529/",
        "temporada": 2,
        "setmana": 40,
        "mida": 52709668,
        "durada_text": "00:54:54",
        "durada_ms": 3294000,
        "data_text": "03/06/2022 22:00",
        "data": "2022-06-03T22:00:00+02:00"
    },
    {
        "title": "Millors moments (temporada 2, setmana 41)",
        "urlArxiu": "https://audios.3catvideos.cat/multimedia/mp3/1/7/1654857066171.mp3",
        "urlPagina": "https://www.3cat.cat/3cat/millors-moments-setmana-41/audio/1138210/",
        "temporada": 2,
        "setmana": 41,
        "mida": 52517407,
        "durada_text": "00:54:42",
        "durada_ms": 3282000,
        "data_text": "10/06/2022 22:00",
        "data": "2022-06-10T22:00:00+02:00"
    },
    {
        "title": "Millors moments (temporada 2, setmana 42)",
        "urlArxiu": "https://audios.3catvideos.cat/multimedia/mp3/0/5/1655480111550.mp3",
        "urlPagina": "https://www.3cat.cat/3cat/millors-moments-setmana-42/audio/1139048/",
        "temporada": 2,
        "setmana": 42,
        "mida": 52981342,
        "durada_text": "00:55:11",
        "durada_ms": 3311000,
        "data_text": "17/06/2022 22:00",
        "data": "2022-06-17T22:00:00+02:00"
    },
    {
        "title": "Millors moments (temporada 2, setmana 43)",
        "urlArxiu": "https://audios.3catvideos.cat/multimedia/mp3/2/9/1655979323092.mp3",
        "urlPagina": "https://www.3cat.cat/3cat/millors-moments-setmana-43/audio/1139649/",
        "temporada": 2,
        "setmana": 43,
        "mida": 52676231,
        "durada_text": "00:54:52",
        "durada_ms": 3292000,
        "data_text": "24/06/2022 22:00",
        "data": "2022-06-24T22:00:00+02:00"
    },
    {
        "title": "Millors moments (temporada 2, setmana 44)",
        "urlArxiu": "https://audios.3catvideos.cat/multimedia/mp3/9/1/1656424864119.mp3",
        "urlPagina": "https://www.3cat.cat/3cat/millors-moments-setmana-44/audio/1140119/",
        "temporada": 2,
        "setmana": 44,
        "mida": 52014184,
        "durada_text": "00:54:10",
        "durada_ms": 3250000,
        "data_text": "01/07/2022 22:00",
        "data": "2022-07-01T22:00:00+02:00"
    },
    {
        "title": "Millors moments (temporada 2, setmana 45)",
        "urlArxiu": "https://audios.3catvideos.cat/multimedia/mp3/2/6/1657276536662.mp3",
        "urlPagina": "https://www.3cat.cat/3cat/millors-moments-setmana-45/audio/1141164/",
        "temporada": 2,
        "setmana": 45,
        "mida": 52798275,
        "durada_text": "00:54:59",
        "durada_ms": 3299000,
        "data_text": "08/07/2022 22:00",
        "data": "2022-07-08T22:00:00+02:00"
    },
    {
        "title": "Millors moments (temporada 2, setmana 46)",
        "urlArxiu": "https://audios.3catvideos.cat/multimedia/mp3/3/0/1657879557603.mp3",
        "urlPagina": "https://www.3cat.cat/3cat/millors-moments-setmana-46/audio/1141926/",
        "temporada": 2,
        "setmana": 46,
        "mida": 52500689,
        "durada_text": "00:54:41",
        "durada_ms": 3281000,
        "data_text": "15/07/2022 22:00",
        "data": "2022-07-15T22:00:00+02:00"
    },
    {
        "title": "Millors moments (temporada 3, setmana 1)",
        "urlArxiu": "https://audios.3catvideos.cat/multimedia/mp3/4/1/1662122426014.mp3",
        "urlPagina": "https://www.3cat.cat/3cat/millors-moments-setmana-1/audio/1144876/",
        "temporada": 3,
        "setmana": 1,
        "mida": 50267533,
        "durada_text": "00:52:21",
        "durada_ms": 3141000,
        "data_text": "02/09/2022 21:00",
        "data": "2022-09-02T21:00:00+02:00"
    },
    {
        "title": "Millors moments (temporada 3, setmana 2)",
        "urlArxiu": "https://audios.3catvideos.cat/multimedia/mp3/0/3/1662722111330.mp3",
        "urlPagina": "https://www.3cat.cat/3cat/millors-moments-setmana-2/audio/1145582/",
        "temporada": 3,
        "setmana": 2,
        "mida": 50216124,
        "durada_text": "00:52:18",
        "durada_ms": 3138000,
        "data_text": "09/09/2022 21:00",
        "data": "2022-09-09T21:00:00+02:00"
    },
    {
        "title": "Millors moments (temporada 3, setmana 3)",
        "urlArxiu": "https://audios.3catvideos.cat/multimedia/mp3/4/7/1663320927874.mp3",
        "urlPagina": "https://www.3cat.cat/3cat/millors-moments-setmana-3/audio/1146306/",
        "temporada": 3,
        "setmana": 3,
        "mida": 49860022,
        "durada_text": "00:51:56",
        "durada_ms": 3116000,
        "data_text": "16/09/2022 21:00",
        "data": "2022-09-16T21:00:00+02:00"
    },
    {
        "title": "Millors moments (temporada 3, setmana 4)",
        "urlArxiu": "https://audios.3catvideos.cat/multimedia/mp3/3/0/1663934473103.mp3",
        "urlPagina": "https://www.3cat.cat/3cat/millors-moments-setmana-4/audio/1147108/",
        "temporada": 3,
        "setmana": 4,
        "mida": 50030968,
        "durada_text": "00:52:06",
        "durada_ms": 3126000,
        "data_text": "23/09/2022 21:00",
        "data": "2022-09-23T21:00:00+02:00"
    },
    {
        "title": "Millors moments (temporada 3, setmana 5)",
        "urlArxiu": "https://audios.3catvideos.cat/multimedia/mp3/3/2/1664468139623.mp3",
        "urlPagina": "https://www.3cat.cat/3cat/millors-moments-setmana-5/audio/1147755/",
        "temporada": 3,
        "setmana": 5,
        "mida": 50113724,
        "durada_text": "00:52:12",
        "durada_ms": 3132000,
        "data_text": "30/09/2022 21:00",
        "data": "2022-09-30T21:00:00+02:00"
    },
    {
        "title": "Millors moments (temporada 3, setmana 6)",
        "urlArxiu": "https://audios.3catvideos.cat/multimedia/mp3/5/3/1665150035835.mp3",
        "urlPagina": "https://www.3cat.cat/3cat/millors-moments-setmana-6/audio/1148687/",
        "temporada": 3,
        "setmana": 6,
        "mida": 50273802,
        "durada_text": "00:52:22",
        "durada_ms": 3142000,
        "data_text": "07/10/2022 21:00",
        "data": "2022-10-07T21:00:00+02:00"
    },
    {
        "title": "Millors moments (temporada 3, setmana 7)",
        "urlArxiu": "https://audios.3catvideos.cat/multimedia/mp3/1/2/1665656428521.mp3",
        "urlPagina": "https://www.3cat.cat/3cat/millors-moments-setmana-7/audio/1149250/",
        "temporada": 3,
        "setmana": 7,
        "mida": 49503921,
        "durada_text": "00:51:33",
        "durada_ms": 3093000,
        "data_text": "14/10/2022 21:00",
        "data": "2022-10-14T21:00:00+02:00"
    },
    {
        "title": "Millors moments (temporada 3, setmana 8)",
        "urlArxiu": "https://audios.3catvideos.cat/multimedia/mp3/4/9/1666353061494.mp3",
        "urlPagina": "https://www.3cat.cat/3cat/millors-moments-setmana-8/audio/1150203/",
        "temporada": 3,
        "setmana": 8,
        "mida": 50158027,
        "durada_text": "00:52:14",
        "durada_ms": 3134000,
        "data_text": "21/10/2022 21:00",
        "data": "2022-10-21T21:00:00+02:00"
    },
    {
        "title": "Millors moments (temporada 3, setmana 9)",
        "urlArxiu": "https://audios.3catvideos.cat/multimedia/mp3/7/2/1666965927827.mp3",
        "urlPagina": "https://www.3cat.cat/3cat/millors-moments-setmana-9/audio/1151015/",
        "temporada": 3,
        "setmana": 9,
        "mida": 50002546,
        "durada_text": "00:52:05",
        "durada_ms": 3125000,
        "data_text": "28/10/2022 21:00",
        "data": "2022-10-28T21:00:00+02:00"
    },
    {
        "title": "Millors moments (temporada 3, setmana 10)",
        "urlArxiu": "https://audios.3catvideos.cat/multimedia/mp3/5/5/1667405122155.mp3",
        "urlPagina": "https://www.3cat.cat/3cat/millors-moments-setmana-10/audio/1151444/",
        "temporada": 3,
        "setmana": 10,
        "mida": 49530253,
        "durada_text": "00:51:35",
        "durada_ms": 3095000,
        "data_text": "04/11/2022 21:00",
        "data": "2022-11-04T21:00:00+01:00"
    },
    {
        "title": "Millors moments (temporada 3, setmana 11)",
        "urlArxiu": "https://audios.3catvideos.cat/multimedia/mp3/1/0/1668165352601.mp3",
        "urlPagina": "https://www.3cat.cat/3cat/millors-moments-setmana-11/audio/1152438/",
        "temporada": 3,
        "setmana": 11,
        "mida": 50107872,
        "durada_text": "00:52:11",
        "durada_ms": 3131000,
        "data_text": "11/11/2022 21:00",
        "data": "2022-11-11T21:00:00+01:00"
    },
    {
        "title": "Millors moments (temporada 3, setmana 12)",
        "urlArxiu": "https://audios.3catvideos.cat/multimedia/mp3/6/5/1668777024956.mp3",
        "urlPagina": "https://www.3cat.cat/3cat/millors-moments-setmana-12/audio/1153225/",
        "temporada": 3,
        "setmana": 12,
        "mida": 50121247,
        "durada_text": "00:52:12",
        "durada_ms": 3132000,
        "data_text": "18/11/2022 21:00",
        "data": "2022-11-18T21:00:00+01:00"
    },
    {
        "title": "Millors moments (temporada 3, setmana 13)",
        "urlArxiu": "https://audios.3catvideos.cat/multimedia/mp3/3/6/1669382443163.mp3",
        "urlPagina": "https://www.3cat.cat/3cat/millors-moments-setmana-13/audio/1153989/",
        "temporada": 3,
        "setmana": 13,
        "mida": 50746932,
        "durada_text": "00:52:51",
        "durada_ms": 3171000,
        "data_text": "25/11/2022 21:00",
        "data": "2022-11-25T21:00:00+01:00"
    },
    {
        "title": "Millors moments (temporada 3, setmana 14)",
        "urlArxiu": "https://audios.3catvideos.cat/multimedia/mp3/4/8/1669983611984.mp3",
        "urlPagina": "https://www.3cat.cat/3cat/millors-moments-setmana-14/audio/1154763/",
        "temporada": 3,
        "setmana": 14,
        "mida": 50309746,
        "durada_text": "00:52:24",
        "durada_ms": 3144000,
        "data_text": "02/12/2022 21:00",
        "data": "2022-12-02T21:00:00+01:00"
    },
    {
        "title": "Millors moments (temporada 3, setmana 15)",
        "urlArxiu": "https://audios.3catvideos.cat/multimedia/mp3/1/0/1670585158301.mp3",
        "urlPagina": "https://www.3cat.cat/3cat/millors-moments-setmana-15/audio/1155431/",
        "temporada": 3,
        "setmana": 15,
        "mida": 50212362,
        "durada_text": "00:52:18",
        "durada_ms": 3138000,
        "data_text": "09/12/2022 21:00",
        "data": "2022-12-09T21:00:00+01:00"
    },
    {
        "title": "Millors moments (temporada 3, setmana 16)",
        "urlArxiu": "https://audios.3catvideos.cat/multimedia/mp3/4/9/1671188723894.mp3",
        "urlPagina": "https://www.3cat.cat/3cat/millors-moments-setmana-16/audio/1156198/",
        "temporada": 3,
        "setmana": 16,
        "mida": 49735471,
        "durada_text": "00:51:48",
        "durada_ms": 3108000,
        "data_text": "16/12/2022 21:00",
        "data": "2022-12-16T21:00:00+01:00"
    },
    {
        "title": "Millors moments (temporada 3, setmana 17)",
        "urlArxiu": "https://audios.3catvideos.cat/multimedia/mp3/2/6/1671722737362.mp3",
        "urlPagina": "https://www.3cat.cat/3cat/millors-moments-setmana-17/audio/1156872/",
        "temporada": 3,
        "setmana": 17,
        "mida": 50134622,
        "durada_text": "00:52:13",
        "durada_ms": 3133000,
        "data_text": "23/12/2022 21:00",
        "data": "2022-12-23T21:00:00+01:00"
    },
    {
        "title": "Millors moments (temporada 3, setmana 18)",
        "urlArxiu": "https://audios.3catvideos.cat/multimedia/mp3/7/9/1672398342897.mp3",
        "urlPagina": "https://www.3cat.cat/3cat/millors-moments-setmana-18/audio/1157568/",
        "temporada": 3,
        "setmana": 18,
        "mida": 50355722,
        "durada_text": "00:52:27",
        "durada_ms": 3147000,
        "data_text": "30/12/2022 21:00",
        "data": "2022-12-30T21:00:00+01:00"
    },
    {
        "title": "Millors moments (temporada 3, setmana 19)",
        "urlArxiu": "https://audios.3catvideos.cat/multimedia/mp3/4/7/1672837836974.mp3",
        "urlPagina": "https://www.3cat.cat/3cat/millors-moments-setmana-19/audio/1157970/",
        "temporada": 3,
        "setmana": 19,
        "mida": 50143817,
        "durada_text": "00:52:13",
        "durada_ms": 3133000,
        "data_text": "06/01/2023 21:00",
        "data": "2023-01-06T21:00:00+01:00"
    },
    {
        "title": "Millors moments (temporada 3, setmana 20)",
        "urlArxiu": "https://audios.3catvideos.cat/multimedia/mp3/6/0/1673619640406.mp3",
        "urlPagina": "https://www.3cat.cat/3cat/millors-moments-setmana-20/audio/1158937/",
        "temporada": 3,
        "setmana": 20,
        "mida": 49929404,
        "durada_text": "00:52:00",
        "durada_ms": 3120000,
        "data_text": "13/01/2023 21:00",
        "data": "2023-01-13T21:00:00+01:00"
    },
    {
        "title": "Millors moments (temporada 3, setmana 21)",
        "urlArxiu": "https://audios.3catvideos.cat/multimedia/mp3/2/9/1674217243892.mp3",
        "urlPagina": "https://www.3cat.cat/3cat/millors-moments-setmana-21/audio/1159680/",
        "temporada": 3,
        "setmana": 21,
        "mida": 50150504,
        "durada_text": "00:52:14",
        "durada_ms": 3134000,
        "data_text": "20/01/2023 21:00",
        "data": "2023-01-20T21:00:00+01:00"
    },
    {
        "title": "Millors moments (temporada 3, setmana 22)",
        "urlArxiu": "https://audios.3catvideos.cat/multimedia/mp3/6/9/1674822014096.mp3",
        "urlPagina": "https://www.3cat.cat/3cat/millors-moments-setmana-22/audio/1160447/",
        "temporada": 3,
        "setmana": 22,
        "mida": 50303895,
        "durada_text": "00:52:23",
        "durada_ms": 3143000,
        "data_text": "27/01/2023 21:00",
        "data": "2023-01-27T21:00:00+01:00"
    },
    {
        "title": "Millors moments (temporada 3, setmana 23)",
        "urlArxiu": "https://audios.3catvideos.cat/multimedia/mp3/8/6/1675430709568.mp3",
        "urlPagina": "https://www.3cat.cat/3cat/millors-moments-setmana-23/audio/1161237/",
        "temporada": 3,
        "setmana": 23,
        "mida": 49980813,
        "durada_text": "00:52:03",
        "durada_ms": 3123000,
        "data_text": "03/02/2023 21:00",
        "data": "2023-02-03T21:00:00+01:00"
    },
    {
        "title": "Millors moments (temporada 3, setmana 24)",
        "urlArxiu": "https://audios.3catvideos.cat/multimedia/mp3/5/6/1676036107665.mp3",
        "urlPagina": "https://www.3cat.cat/3cat/millors-moments-setmana-24/audio/1161994/",
        "temporada": 3,
        "setmana": 24,
        "mida": 50321449,
        "durada_text": "00:52:25",
        "durada_ms": 3145000,
        "data_text": "10/02/2023 21:00",
        "data": "2023-02-10T21:00:00+01:00"
    },
    {
        "title": "Millors moments (temporada 3, setmana 25)",
        "urlArxiu": "https://audios.3catvideos.cat/multimedia/mp3/2/4/1676630161042.mp3",
        "urlPagina": "https://www.3cat.cat/3cat/millors-moments-setmana-25/audio/1162762/",
        "temporada": 3,
        "setmana": 25,
        "mida": 50125844,
        "durada_text": "00:52:12",
        "durada_ms": 3132000,
        "data_text": "17/02/2023 21:00",
        "data": "2023-02-17T21:00:00+01:00"
    },
    {
        "title": "Millors moments (temporada 3, setmana 26)",
        "urlArxiu": "https://audios.3catvideos.cat/multimedia/mp3/7/8/1677251451787.mp3",
        "urlPagina": "https://www.3cat.cat/3cat/millors-moments-setmana-26/audio/1163575/",
        "temporada": 3,
        "setmana": 26,
        "mida": 49936509,
        "durada_text": "00:52:01",
        "durada_ms": 3121000,
        "data_text": "24/02/2023 21:00",
        "data": "2023-02-24T21:00:00+01:00"
    },
    {
        "title": "Millors moments (temporada 3, setmana 27)",
        "urlArxiu": "https://audios.3catvideos.cat/multimedia/mp3/5/7/1677858656275.mp3",
        "urlPagina": "https://www.3cat.cat/3cat/millors-moments-setmana-27/audio/1164362/",
        "temporada": 3,
        "setmana": 27,
        "mida": 50402533,
        "durada_text": "00:52:30",
        "durada_ms": 3150000,
        "data_text": "03/03/2023 21:00",
        "data": "2023-03-03T21:00:00+01:00"
    },
    {
        "title": "Millors moments (temporada 3, setmana 28)",
        "urlArxiu": "https://audios.3catvideos.cat/multimedia/mp3/7/0/1678446338707.mp3",
        "urlPagina": "https://www.3cat.cat/3cat/millors-moments-setmana-28/audio/1165094/",
        "temporada": 3,
        "setmana": 28,
        "mida": 49508101,
        "durada_text": "00:51:34",
        "durada_ms": 3094000,
        "data_text": "10/03/2023 21:00",
        "data": "2023-03-10T21:00:00+01:00"
    },
    {
        "title": "Millors moments (temporada 3, setmana 29)",
        "urlArxiu": "https://audios.3catvideos.cat/multimedia/mp3/6/5/1679064348556.mp3",
        "urlPagina": "https://www.3cat.cat/3cat/millors-moments-setmana-29/audio/1165916/",
        "temporada": 3,
        "setmana": 29,
        "mida": 49854171,
        "durada_text": "00:51:55",
        "durada_ms": 3115000,
        "data_text": "17/03/2023 21:00",
        "data": "2023-03-17T21:00:00+01:00"
    },
    {
        "title": "Millors moments (temporada 3, setmana 30)",
        "urlArxiu": "https://audios.3catvideos.cat/multimedia/mp3/7/2/1679411130827.mp3",
        "urlPagina": "https://www.3cat.cat/3cat/millors-moments-setmana-30/audio/1166282/",
        "temporada": 3,
        "setmana": 30,
        "mida": 50295536,
        "durada_text": "00:52:23",
        "durada_ms": 3143000,
        "data_text": "24/03/2023 21:00",
        "data": "2023-03-24T21:00:00+01:00"
    },
    {
        "title": "Millors moments (temporada 3, setmana 31)",
        "urlArxiu": "https://audios.3catvideos.cat/multimedia/mp3/1/5/1680197164851.mp3",
        "urlPagina": "https://www.3cat.cat/3cat/millors-moments-setmana-31/audio/1167324/",
        "temporada": 3,
        "setmana": 31,
        "mida": 50227409,
        "durada_text": "00:52:19",
        "durada_ms": 3139000,
        "data_text": "31/03/2023 21:00",
        "data": "2023-03-31T21:00:00+02:00"
    },
    {
        "title": "Millors moments (temporada 3, setmana 32)",
        "urlArxiu": "https://audios.3catvideos.cat/multimedia/mp3/8/9/1680599128298.mp3",
        "urlPagina": "https://www.3cat.cat/3cat/millors-moments-setmana-32/audio/1167796/",
        "temporada": 3,
        "setmana": 32,
        "mida": 50381217,
        "durada_text": "00:52:28",
        "durada_ms": 3148000,
        "data_text": "07/04/2023 21:00",
        "data": "2023-04-07T21:00:00+02:00"
    },
    {
        "title": "Millors moments (temporada 3, setmana 33)",
        "urlArxiu": "https://audios.3catvideos.cat/multimedia/mp3/0/2/1681215350320.mp3",
        "urlPagina": "https://www.3cat.cat/3cat/millors-moments-setmana-33/audio/1168406/",
        "temporada": 3,
        "setmana": 33,
        "mida": 50295954,
        "durada_text": "00:52:23",
        "durada_ms": 3143000,
        "data_text": "14/04/2023 21:00",
        "data": "2023-04-14T21:00:00+02:00"
    },
    {
        "title": "Millors moments (temporada 3, setmana 34)",
        "urlArxiu": "https://audios.3catvideos.cat/multimedia/mp3/4/9/1682006706394.mp3",
        "urlPagina": "https://www.3cat.cat/3cat/millors-moments-setmana-34/audio/1169435/",
        "temporada": 3,
        "setmana": 34,
        "mida": 49768489,
        "durada_text": "00:51:50",
        "durada_ms": 3110000,
        "data_text": "21/04/2023 21:00",
        "data": "2023-04-21T21:00:00+02:00"
    },
    {
        "title": "Millors moments (temporada 3, setmana 35)",
        "urlArxiu": "https://audios.3catvideos.cat/multimedia/mp3/0/0/1682694038000.mp3",
        "urlPagina": "https://www.3cat.cat/3cat/millors-moments-setmana-35/audio/1170291/",
        "temporada": 3,
        "setmana": 35,
        "mida": 49883846,
        "durada_text": "00:51:57",
        "durada_ms": 3117000,
        "data_text": "28/04/2023 21:00",
        "data": "2023-04-28T21:00:00+02:00"
    },
    {
        "title": "Millors moments (temporada 3, setmana 36)",
        "urlArxiu": "https://audios.3catvideos.cat/multimedia/mp3/4/6/1683297645364.mp3",
        "urlPagina": "https://www.3cat.cat/3cat/millors-moments-setmana-36/audio/1170987/",
        "temporada": 3,
        "setmana": 36,
        "mida": 49747173,
        "durada_text": "00:51:49",
        "durada_ms": 3109000,
        "data_text": "05/05/2023 21:00",
        "data": "2023-05-05T21:00:00+02:00"
    },
    {
        "title": "Millors moments (temporada 3, setmana 37)",
        "urlArxiu": "https://audios.3catvideos.cat/multimedia/mp3/3/8/1683885931583.mp3",
        "urlPagina": "https://www.3cat.cat/3cat/millors-moments-setmana-37/audio/1171715/",
        "temporada": 3,
        "setmana": 37,
        "mida": 50043924,
        "durada_text": "00:52:07",
        "durada_ms": 3127000,
        "data_text": "12/05/2023 21:00",
        "data": "2023-05-12T21:00:00+02:00"
    },
    {
        "title": "Millors moments (temporada 3, setmana 38)",
        "urlArxiu": "https://audios.3catvideos.cat/multimedia/mp3/0/4/1684492234240.mp3",
        "urlPagina": "https://www.3cat.cat/3cat/millors-moments-setmana-38/audio/1172491/",
        "temporada": 3,
        "setmana": 38,
        "mida": 49865874,
        "durada_text": "00:51:56",
        "durada_ms": 3116000,
        "data_text": "19/05/2023 21:00",
        "data": "2023-05-19T21:00:00+02:00"
    },
    {
        "title": "Millors moments (temporada 3, setmana 39)",
        "urlArxiu": "https://audios.3catvideos.cat/multimedia/mp3/6/5/1685094032256.mp3",
        "urlPagina": "https://www.3cat.cat/3cat/millors-moments-setmana-39/audio/1173304/",
        "temporada": 3,
        "setmana": 39,
        "mida": 50074017,
        "durada_text": "00:52:09",
        "durada_ms": 3129000,
        "data_text": "26/05/2023 21:00",
        "data": "2023-05-26T21:00:00+02:00"
    },
    {
        "title": "Millors moments (temporada 3, setmana 40)",
        "urlArxiu": "https://audios.3catvideos.cat/multimedia/mp3/4/7/1685384757674.mp3",
        "urlPagina": "https://www.3cat.cat/3cat/millors-moments-setmana-40/audio/1173627/",
        "temporada": 3,
        "setmana": 40,
        "mida": 50280489,
        "durada_text": "00:52:22",
        "durada_ms": 3142000,
        "data_text": "02/06/2023 21:00",
        "data": "2023-06-02T21:00:00+02:00"
    },
    {
        "title": "Millors moments (temporada 3, setmana 41)",
        "urlArxiu": "https://audios.3catvideos.cat/multimedia/mp3/8/3/1686319224438.mp3",
        "urlPagina": "https://www.3cat.cat/3cat/millors-moments-setmana-41/audio/1174853/",
        "temporada": 3,
        "setmana": 41,
        "mida": 50203585,
        "durada_text": "00:52:17",
        "durada_ms": 3137000,
        "data_text": "09/06/2023 21:00",
        "data": "2023-06-09T21:00:00+02:00"
    },
    {
        "title": "Millors moments (temporada 3, setmana 42)",
        "urlArxiu": "https://audios.3catvideos.cat/multimedia/mp3/8/2/1686912013428.mp3",
        "urlPagina": "https://www.3cat.cat/3cat/millors-moments-setmana-42/audio/1175538/",
        "temporada": 3,
        "setmana": 42,
        "mida": 50022191,
        "durada_text": "00:52:06",
        "durada_ms": 3126000,
        "data_text": "16/06/2023 21:00",
        "data": "2023-06-16T21:00:00+02:00"
    },
    {
        "title": "Millors moments (temporada 3, setmana 43)",
        "urlArxiu": "https://audios.3catvideos.cat/multimedia/mp3/8/2/1687516233628.mp3",
        "urlPagina": "https://www.3cat.cat/3cat/millors-moments-setmana-43/audio/1176318/",
        "temporada": 3,
        "setmana": 43,
        "mida": 50422177,
        "durada_text": "00:52:31",
        "durada_ms": 3151000,
        "data_text": "23/06/2023 21:00",
        "data": "2023-06-23T21:00:00+02:00"
    },
    {
        "title": "Millors moments (temporada 3, setmana 44)",
        "urlArxiu": "https://audios.3catvideos.cat/multimedia/mp3/8/5/1688116526158.mp3",
        "urlPagina": "https://www.3cat.cat/3cat/millors-moments-setmana-44/audio/1176999/",
        "temporada": 3,
        "setmana": 44,
        "mida": 49472156,
        "durada_text": "00:51:32",
        "durada_ms": 3092000,
        "data_text": "30/06/2023 21:00",
        "data": "2023-06-30T21:00:00+02:00"
    },
    {
        "title": "Millors moments (temporada 3, setmana 45)",
        "urlArxiu": "https://audios.3catvideos.cat/multimedia/mp3/4/2/1688725250624.mp3",
        "urlPagina": "https://www.3cat.cat/3cat/millors-moments-setmana-45/audio/1177706/",
        "temporada": 3,
        "setmana": 45,
        "mida": 50255830,
        "durada_text": "00:52:20",
        "durada_ms": 3140000,
        "data_text": "07/07/2023 21:00",
        "data": "2023-07-07T21:00:00+02:00"
    },
    {
        "title": "Millors moments (temporada 4, setmana 1)",
        "urlArxiu": "https://audios.3catvideos.cat/multimedia/mp3/1/1/1694175643411.mp3",
        "urlPagina": "https://www.3cat.cat/3cat/millors-moments-setmana-01/audio/1181587/",
        "temporada": 4,
        "setmana": 1,
        "mida": 50127934,
        "durada_text": "00:52:12",
        "durada_ms": 3132000,
        "data_text": "08/09/2023 21:00",
        "data": "2023-09-08T21:00:00+02:00"
    },
    {
        "title": "Millors moments (temporada 4, setmana 2)",
        "urlArxiu": "https://audios.3catvideos.cat/multimedia/mp3/4/0/1694780742204.mp3",
        "urlPagina": "https://www.3cat.cat/3cat/millors-moments-setmana-02/audio/1182313/",
        "temporada": 4,
        "setmana": 2,
        "mida": 50522488,
        "durada_text": "00:52:37",
        "durada_ms": 3157000,
        "data_text": "15/09/2023 21:00",
        "data": "2023-09-15T21:00:00+02:00"
    },
    {
        "title": "Millors moments (temporada 4, setmana 3)",
        "urlArxiu": "https://audios.3catvideos.cat/multimedia/mp3/3/1/1695382243613.mp3",
        "urlPagina": "https://www.3cat.cat/3cat/millors-moments-setmana-03/audio/1183048/",
        "temporada": 4,
        "setmana": 3,
        "mida": 50186449,
        "durada_text": "00:52:16",
        "durada_ms": 3136000,
        "data_text": "22/09/2023 21:00",
        "data": "2023-09-22T21:00:00+02:00"
    },
    {
        "title": "Millors moments (temporada 4, setmana 4)",
        "urlArxiu": "https://audios.3catvideos.cat/multimedia/mp3/3/3/1696053311233.mp3",
        "urlPagina": "https://www.3cat.cat/3cat/millors-moments-setmana-4/audio/1183821/",
        "temporada": 4,
        "setmana": 4,
        "mida": 50117067,
        "durada_text": "00:52:12",
        "durada_ms": 3132000,
        "data_text": "29/09/2023 21:00",
        "data": "2023-09-29T21:00:00+02:00"
    },
    {
        "title": "Millors moments (temporada 4, setmana 5)",
        "urlArxiu": "https://audios.3catvideos.cat/multimedia/mp3/4/9/1696590913094.mp3",
        "urlPagina": "https://www.3cat.cat/3cat/millors-moments-setmana-5/audio/1184513/",
        "temporada": 4,
        "setmana": 5,
        "mida": 49930657,
        "durada_text": "00:52:00",
        "durada_ms": 3120000,
        "data_text": "06/10/2023 21:00",
        "data": "2023-10-06T21:00:00+02:00"
    },
    {
        "title": "Millors moments (temporada 4, setmana 6)",
        "urlArxiu": "https://audios.3catvideos.cat/multimedia/mp3/0/6/1697023865560.mp3",
        "urlPagina": "https://www.3cat.cat/3cat/millors-moments-setmana-6/audio/1185026/",
        "temporada": 4,
        "setmana": 6,
        "mida": 50042671,
        "durada_text": "00:52:07",
        "durada_ms": 3127000,
        "data_text": "13/10/2023 21:00",
        "data": "2023-10-13T21:00:00+02:00"
    },
    {
        "title": "Millors moments (temporada 4, setmana 7)",
        "urlArxiu": "https://audios.3catvideos.cat/multimedia/mp3/3/8/1697795755683.mp3",
        "urlPagina": "https://www.3cat.cat/3cat/millors-moments-setmana-07/audio/1185974/",
        "temporada": 4,
        "setmana": 7,
        "mida": 50121665,
        "durada_text": "00:52:12",
        "durada_ms": 3132000,
        "data_text": "20/10/2023 21:00",
        "data": "2023-10-20T21:00:00+02:00"
    },
    {
        "title": "Millors moments (temporada 4, setmana 8)",
        "urlArxiu": "https://audios.3catvideos.cat/multimedia/mp3/3/3/1698405361233.mp3",
        "urlPagina": "https://www.3cat.cat/3cat/millors-moments-setmana-9/audio/1186753/",
        "temporada": 4,
        "setmana": 8,
        "mida": 50100767,
        "durada_text": "00:52:11",
        "durada_ms": 3131000,
        "data_text": "27/10/2023 21:00",
        "data": "2023-10-27T21:00:00+02:00"
    },
    {
        "title": "Millors moments (temporada 4, setmana 9)",
        "urlArxiu": "https://audios.3catvideos.cat/multimedia/mp3/2/9/1698922826392.mp3",
        "urlPagina": "https://www.3cat.cat/3cat/millors-moments-setmana-9/audio/1187322/",
        "temporada": 4,
        "setmana": 9,
        "mida": 50142981,
        "durada_text": "00:52:13",
        "durada_ms": 3133000,
        "data_text": "03/11/2023 21:00",
        "data": "2023-11-03T21:00:00+01:00"
    },
    {
        "title": "Millors moments (temporada 4, setmana 10)",
        "urlArxiu": "https://audios.3catvideos.cat/multimedia/mp3/0/2/1699608962320.mp3",
        "urlPagina": "https://www.3cat.cat/3cat/millors-moments-setmana-10/audio/1188219/",
        "temporada": 4,
        "setmana": 10,
        "mida": 50384143,
        "durada_text": "00:52:29",
        "durada_ms": 3149000,
        "data_text": "10/11/2023 21:00",
        "data": "2023-11-10T21:00:00+01:00"
    },
    {
        "title": "Millors moments (temporada 4, setmana 11)",
        "urlArxiu": "https://audios.3catvideos.cat/multimedia/mp3/4/9/1700222750394.mp3",
        "urlPagina": "https://www.3cat.cat/3cat/millors-moments-setmana-11/audio/1189030/",
        "temporada": 4,
        "setmana": 11,
        "mida": 49951555,
        "durada_text": "00:52:01",
        "durada_ms": 3121000,
        "data_text": "17/11/2023 21:00",
        "data": "2023-11-17T21:00:00+01:00"
    },
    {
        "title": "Millors moments (temporada 4, setmana 12)",
        "urlArxiu": "https://audios.3catvideos.cat/multimedia/mp3/5/5/1700822116155.mp3",
        "urlPagina": "https://www.3cat.cat/3cat/millors-moments-setmana-12/audio/1189762/",
        "temporada": 4,
        "setmana": 12,
        "mida": 49660656,
        "durada_text": "00:51:43",
        "durada_ms": 3103000,
        "data_text": "24/11/2023 21:00",
        "data": "2023-11-24T21:00:00+01:00"
    },
    {
        "title": "Millors moments (temporada 4, setmana 13)",
        "urlArxiu": "https://audios.3catvideos.cat/multimedia/mp3/6/8/1701427840786.mp3",
        "urlPagina": "https://www.3cat.cat/3cat/millors-moments-setmana-13/audio/1190474/",
        "temporada": 4,
        "setmana": 13,
        "mida": 50313926,
        "durada_text": "00:52:24",
        "durada_ms": 3144000,
        "data_text": "01/12/2023 21:00",
        "data": "2023-12-01T21:00:00+01:00"
    },
    {
        "title": "Millors moments (temporada 4, setmana 14)",
        "urlArxiu": "https://audios.3catvideos.cat/multimedia/mp3/6/0/1701710456206.mp3",
        "urlPagina": "https://www.3cat.cat/3cat/millors-moments-setmana-14/audio/1190783/",
        "temporada": 4,
        "setmana": 14,
        "mida": 49977051,
        "durada_text": "00:52:03",
        "durada_ms": 3123000,
        "data_text": "08/12/2023 21:00",
        "data": "2023-12-08T21:00:00+01:00"
    },
    {
        "title": "Millors moments (temporada 4, setmana 15)",
        "urlArxiu": "https://audios.3catvideos.cat/multimedia/mp3/0/6/1702651221360.mp3",
        "urlPagina": "https://www.3cat.cat/3cat/millors-moments-setmana-15/audio/1191945/",
        "temporada": 4,
        "setmana": 15,
        "mida": 49973289,
        "durada_text": "00:52:03",
        "durada_ms": 3123000,
        "data_text": "15/12/2023 21:00",
        "data": "2023-12-15T21:00:00+01:00"
    },
    {
        "title": "Millors moments (temporada 4, setmana 16)",
        "urlArxiu": "https://audios.3catvideos.cat/multimedia/mp3/9/9/1703167523999.mp3",
        "urlPagina": "https://www.3cat.cat/3cat/millors-moments-setmana-16/audio/1192596/",
        "temporada": 4,
        "setmana": 16,
        "mida": 50224901,
        "durada_text": "00:52:19",
        "durada_ms": 3139000,
        "data_text": "22/12/2023 21:00",
        "data": "2023-12-22T21:00:00+01:00"
    },
    {
        "title": "Millors moments (temporada 4, setmana 17)",
        "urlArxiu": "https://audios.3catvideos.cat/multimedia/mp3/5/1/1703846131315.mp3",
        "urlPagina": "https://www.3cat.cat/3cat/millors-moments-setmana-17/audio/1193216/",
        "temporada": 4,
        "setmana": 17,
        "mida": 49851245,
        "durada_text": "00:51:55",
        "durada_ms": 3115000,
        "data_text": "29/12/2023 21:00",
        "data": "2023-12-29T21:00:00+01:00"
    },
    {
        "title": "Millors moments (temporada 4, setmana 18)",
        "urlArxiu": "https://audios.3catvideos.cat/multimedia/mp3/0/3/1704453924130.mp3",
        "urlPagina": "https://www.3cat.cat/3cat/millors-moments-setmana-18/audio/1193775/",
        "temporada": 4,
        "setmana": 18,
        "mida": 50307657,
        "durada_text": "00:52:24",
        "durada_ms": 3144000,
        "data_text": "05/01/2024 21:00",
        "data": "2024-01-05T21:00:00+01:00"
    },
    {
        "title": "Millors moments (temporada 4, setmana 19)",
        "urlArxiu": "https://audios.3catvideos.cat/multimedia/mp3/0/4/1705070759140.mp3",
        "urlPagina": "https://www.3cat.cat/3cat/millors-moments-setmana-19/audio/1194515/",
        "temporada": 4,
        "setmana": 19,
        "mida": 50400026,
        "durada_text": "00:52:30",
        "durada_ms": 3150000,
        "data_text": "12/01/2024 21:00",
        "data": "2024-01-12T21:00:00+01:00"
    },
    {
        "title": "Millors moments (temporada 4, setmana 20)",
        "urlArxiu": "https://audios.3catvideos.cat/multimedia/mp3/4/0/1705583773804.mp3",
        "urlPagina": "https://www.3cat.cat/3cat/millors-moments-setmana-20/audio/1195138/",
        "temporada": 4,
        "setmana": 20,
        "mida": 50039327,
        "durada_text": "00:52:07",
        "durada_ms": 3127000,
        "data_text": "19/01/2024 21:00",
        "data": "2024-01-19T21:00:00+01:00"
    },
    {
        "title": "Millors moments (temporada 4, setmana 21)",
        "urlArxiu": "https://audios.3catvideos.cat/multimedia/mp3/8/4/1706272227548.mp3",
        "urlPagina": "https://www.3cat.cat/3cat/millors-moments-setmana-21/audio/1196053/",
        "temporada": 4,
        "setmana": 21,
        "mida": 49974961,
        "durada_text": "00:52:03",
        "durada_ms": 3123000,
        "data_text": "26/01/2024 21:00",
        "data": "2024-01-26T21:00:00+01:00"
    },
    {
        "title": "Millors moments (temporada 4, setmana 22)",
        "urlArxiu": "https://audios.3catvideos.cat/multimedia/mp3/3/5/1706871952953.mp3",
        "urlPagina": "https://www.3cat.cat/3cat/millors-moments-setmana-22/audio/1196809/",
        "temporada": 4,
        "setmana": 22,
        "mida": 49855007,
        "durada_text": "00:51:55",
        "durada_ms": 3115000,
        "data_text": "02/02/2024 21:00",
        "data": "2024-02-02T21:00:00+01:00"
    },
    {
        "title": "Millors moments (temporada 4, setmana 23)",
        "urlArxiu": "https://audios.3catvideos.cat/multimedia/mp3/2/8/1707478541982.mp3",
        "urlPagina": "https://www.3cat.cat/3cat/millors-moments-setmana-23/audio/1197586/",
        "temporada": 4,
        "setmana": 23,
        "mida": 50058971,
        "durada_text": "00:52:08",
        "durada_ms": 3128000,
        "data_text": "09/02/2024 21:00",
        "data": "2024-02-09T21:00:00+01:00"
    },
    {
        "title": "Millors moments (temporada 4, setmana 24)",
        "urlArxiu": "https://audios.3catvideos.cat/multimedia/mp3/2/1/1708083919012.mp3",
        "urlPagina": "https://www.3cat.cat/3cat/millors-moments-setmana-24/audio/1198364/",
        "temporada": 4,
        "setmana": 24,
        "mida": 49987918,
        "durada_text": "00:52:04",
        "durada_ms": 3124000,
        "data_text": "16/02/2024 21:00",
        "data": "2024-02-16T21:00:00+01:00"
    },
    {
        "title": "Millors moments (temporada 4, setmana 25)",
        "urlArxiu": "https://audios.3catvideos.cat/multimedia/mp3/7/2/1708348217827.mp3",
        "urlPagina": "https://www.3cat.cat/3cat/millors-moments-setmana-25/audio/1198630/",
        "temporada": 4,
        "setmana": 25,
        "mida": 50198151,
        "durada_text": "00:52:17",
        "durada_ms": 3137000,
        "data_text": "23/02/2024 21:00",
        "data": "2024-02-23T21:00:00+01:00"
    },
    {
        "title": "Millors moments (temporada 4, setmana 26)",
        "urlArxiu": "https://audios.3catvideos.cat/multimedia/mp3/4/0/1709300773704.mp3",
        "urlPagina": "https://www.3cat.cat/3cat/millors-moments-setmana-26/audio/1199918/",
        "temporada": 4,
        "setmana": 26,
        "mida": 50117485,
        "durada_text": "00:52:12",
        "durada_ms": 3132000,
        "data_text": "01/03/2024 21:00",
        "data": "2024-03-01T21:00:00+01:00"
    },
    {
        "title": "Millors moments (temporada 4, setmana 27)",
        "urlArxiu": "https://audios.3catvideos.cat/multimedia/mp3/8/0/1709900726508.mp3",
        "urlPagina": "https://www.3cat.cat/3cat/millors-moments-setmana-27/audio/1200692/",
        "temporada": 4,
        "setmana": 27,
        "mida": 49710811,
        "durada_text": "00:51:46",
        "durada_ms": 3106000,
        "data_text": "08/03/2024 21:00",
        "data": "2024-03-08T21:00:00+01:00"
    },
    {
        "title": "Millors moments (temporada 4, setmana 28)",
        "urlArxiu": "https://audios.3catvideos.cat/multimedia/mp3/3/7/1710500454073.mp3",
        "urlPagina": "https://www.3cat.cat/3cat/millors-moments-setmana-28/audio/1201460/",
        "temporada": 4,
        "setmana": 28,
        "mida": 49990844,
        "durada_text": "00:52:04",
        "durada_ms": 3124000,
        "data_text": "15/03/2024 21:00",
        "data": "2024-03-15T21:00:00+01:00"
    },
    {
        "title": "Millors moments (temporada 4, setmana 29)",
        "urlArxiu": "https://audios.3catvideos.cat/multimedia/mp3/8/9/1710955255698.mp3",
        "urlPagina": "https://www.3cat.cat/3cat/millors-moments-setmana-29/audio/1202032/",
        "temporada": 4,
        "setmana": 29,
        "mida": 50544222,
        "durada_text": "00:52:39",
        "durada_ms": 3159000,
        "data_text": "22/03/2024 21:00",
        "data": "2024-03-22T21:00:00+01:00"
    },
    {
        "title": "Millors moments (temporada 4, setmana 30)",
        "urlArxiu": "https://audios.3catvideos.cat/multimedia/mp3/6/8/1711383944586.mp3",
        "urlPagina": "https://www.3cat.cat/3cat/millors-moments-setmana-30/audio/1202545/",
        "temporada": 4,
        "setmana": 30,
        "mida": 50549655,
        "durada_text": "00:52:39",
        "durada_ms": 3159000,
        "data_text": "29/03/2024 21:00",
        "data": "2024-03-29T21:00:00+01:00"
    },
    {
        "title": "Millors moments (temporada 4, setmana 31)",
        "urlArxiu": "https://audios.3catvideos.cat/multimedia/mp3/8/4/1712326562348.mp3",
        "urlPagina": "https://www.3cat.cat/3cat/millors-moments-setmana-31/audio/1203688/",
        "temporada": 4,
        "setmana": 31,
        "mida": 50126680,
        "durada_text": "00:52:12",
        "durada_ms": 3132000,
        "data_text": "05/04/2024 21:00",
        "data": "2024-04-05T21:00:00+02:00"
    },
    {
        "title": "Millors moments (temporada 4, setmana 32)",
        "urlArxiu": "https://audios.3catvideos.cat/multimedia/mp3/6/2/1712910922626.mp3",
        "urlPagina": "https://www.3cat.cat/3cat/millors-moments-setmana-32/audio/1204437/",
        "temporada": 4,
        "setmana": 32,
        "mida": 50274638,
        "durada_text": "00:52:22",
        "durada_ms": 3142000,
        "data_text": "12/04/2024 21:00",
        "data": "2024-04-12T21:00:00+02:00"
    },
    {
        "title": "Millors moments (temporada 4, setmana 33)",
        "urlArxiu": "https://audios.3catvideos.cat/multimedia/mp3/8/0/1713522654808.mp3",
        "urlPagina": "https://www.3cat.cat/3cat/millors-moments-setmana-33/audio/1205259/",
        "temporada": 4,
        "setmana": 33,
        "mida": 50170566,
        "durada_text": "00:52:15",
        "durada_ms": 3135000,
        "data_text": "19/04/2024 21:00",
        "data": "2024-04-19T21:00:00+02:00"
    },
    {
        "title": "Millors moments (temporada 4, setmana 34)",
        "urlArxiu": "https://audios.3catvideos.cat/multimedia/mp3/8/9/1714133769198.mp3",
        "urlPagina": "https://www.3cat.cat/3cat/millors-moments-setmana-34/audio/1206049/",
        "temporada": 4,
        "setmana": 34,
        "mida": 49475918,
        "durada_text": "00:51:32",
        "durada_ms": 3092000,
        "data_text": "26/04/2024 21:00",
        "data": "2024-04-26T21:00:00+02:00"
    },
    {
        "title": "Millors moments (temporada 4, setmana 35)",
        "urlArxiu": "https://audios.3catvideos.cat/multimedia/mp3/9/3/1714731653639.mp3",
        "urlPagina": "https://www.3cat.cat/3cat/millors-moments-setmana-35/audio/1206706/",
        "temporada": 4,
        "setmana": 35,
        "mida": 50438060,
        "durada_text": "00:52:32",
        "durada_ms": 3152000,
        "data_text": "03/05/2024 21:00",
        "data": "2024-05-03T21:00:00+02:00"
    },
    {
        "title": "Millors moments (temporada 4, setmana 36)",
        "urlArxiu": "https://audios.3catvideos.cat/multimedia/mp3/9/4/1715334960149.mp3",
        "urlPagina": "https://www.3cat.cat/3cat/millors-moments-setmana-36/audio/1207508/",
        "temporada": 4,
        "setmana": 36,
        "mida": 50267951,
        "durada_text": "00:52:21",
        "durada_ms": 3141000,
        "data_text": "10/05/2024 21:00",
        "data": "2024-05-10T21:00:00+02:00"
    },
    {
        "title": "Millors moments (temporada 4, setmana 37)",
        "urlArxiu": "https://audios.3catvideos.cat/multimedia/mp3/1/9/1715858406291.mp3",
        "urlPagina": "https://www.3cat.cat/3cat/millors-moments-setmana-37/audio/1208168/",
        "temporada": 4,
        "setmana": 37,
        "mida": 49923552,
        "durada_text": "00:52:00",
        "durada_ms": 3120000,
        "data_text": "17/05/2024 21:00",
        "data": "2024-05-17T21:00:00+02:00"
    },
    {
        "title": "Millors moments (temporada 4, setmana 38)",
        "urlArxiu": "https://audios.3catvideos.cat/multimedia/mp3/9/1/1716560425919.mp3",
        "urlPagina": "https://www.3cat.cat/3cat/millors-moments-setmana-38/audio/1209090/",
        "temporada": 4,
        "setmana": 38,
        "mida": 49900146,
        "durada_text": "00:51:58",
        "durada_ms": 3118000,
        "data_text": "24/05/2024 21:00",
        "data": "2024-05-24T21:00:00+02:00"
    },
    {
        "title": "Millors moments (temporada 4, setmana 39)",
        "urlArxiu": "https://audios.3catvideos.cat/multimedia/mp3/8/0/1717150879108.mp3",
        "urlPagina": "https://www.3cat.cat/3cat/millors-moments-setmana-39/audio/1209843/",
        "temporada": 4,
        "setmana": 39,
        "mida": 50103275,
        "durada_text": "00:52:11",
        "durada_ms": 3131000,
        "data_text": "31/05/2024 21:00",
        "data": "2024-05-31T21:00:00+02:00"
    },
    {
        "title": "Millors moments (temporada 4, setmana 40)",
        "urlArxiu": "https://audios.3catvideos.cat/multimedia/mp3/6/3/1717758624136.mp3",
        "urlPagina": "https://www.3cat.cat/3cat/millors-moments-setmana-40/audio/1210604/",
        "temporada": 4,
        "setmana": 40,
        "mida": 50241619,
        "durada_text": "00:52:20",
        "durada_ms": 3140000,
        "data_text": "07/06/2024 21:00",
        "data": "2024-06-07T21:00:00+02:00"
    },
    {
        "title": "Millors moments (temporada 4, setmana 41)",
        "urlArxiu": "https://audios.3catvideos.cat/multimedia/mp3/9/1/1718362517019.mp3",
        "urlPagina": "https://www.3cat.cat/3cat/millors-moments-setmana-41/audio/1211373/",
        "temporada": 4,
        "setmana": 41,
        "mida": 50602736,
        "durada_text": "00:52:42",
        "durada_ms": 3162000,
        "data_text": "14/06/2024 21:00",
        "data": "2024-06-14T21:00:00+02:00"
    },
    {
        "title": "Millors moments (temporada 4, setmana 42)",
        "urlArxiu": "https://audios.3catvideos.cat/multimedia/mp3/2/7/1718966445472.mp3",
        "urlPagina": "https://www.3cat.cat/3cat/millors-moments-setmana-42/audio/1212162/",
        "temporada": 4,
        "setmana": 42,
        "mida": 49728783,
        "durada_text": "00:51:48",
        "durada_ms": 3108000,
        "data_text": "21/06/2024 21:00",
        "data": "2024-06-21T21:00:00+02:00"
    },
    {
        "title": "Millors moments (temporada 4, setmana 43)",
        "urlArxiu": "https://audios.3catvideos.cat/multimedia/mp3/9/1/1719567940619.mp3",
        "urlPagina": "https://www.3cat.cat/3cat/millors-moments-setmana-44/audio/1212794/",
        "temporada": 4,
        "setmana": 43,
        "mida": 49952809,
        "durada_text": "00:52:02",
        "durada_ms": 3122000,
        "data_text": "28/06/2024 21:00",
        "data": "2024-06-28T21:00:00+02:00"
    },
    {
        "title": "Millors moments (temporada 4, setmana 44)",
        "urlArxiu": "https://audios.3catvideos.cat/multimedia/mp3/6/1/1720000837416.mp3",
        "urlPagina": "https://www.3cat.cat/3cat/millors-moments-setmana-44/audio/1213308/",
        "temporada": 4,
        "setmana": 44,
        "mida": 49979559,
        "durada_text": "00:52:03",
        "durada_ms": 3123000,
        "data_text": "05/07/2024 21:00",
        "data": "2024-07-05T21:00:00+02:00"
    },
    {
        "title": "Millors moments (especial assassins serials)",
        "urlArxiu": "https://audios.3catvideos.cat/multimedia/mp3/4/3/1721647843834.mp3",
        "urlPagina": "https://www.3cat.cat/3cat/millors-moments-especial-assassins-serials-4t/audio/1214524/",
        "temporada": 4,
        "setmana": 45,
        "mida": 50434716,
        "durada_text": "00:52:32",
        "durada_ms": 3152000,
        "data_text": "23/08/2024 21:00",
        "data": "2024-08-23T21:00:00+02:00"
    },
    {
        "title": "Millors moments (especial assassins en srie)",
        "urlArxiu": "https://audios.3catvideos.cat/multimedia/mp3/9/5/1720603852259.mp3",
        "urlPagina": "https://www.3cat.cat/3cat/millors-moments-especial-assassins-serials-4t/audio/1213850/",
        "temporada": 4,
        "setmana": 46,
        "mida": 50178089,
        "durada_text": "00:52:16",
        "durada_ms": 3136000,
        "data_text": "30/08/2024 21:00",
        "data": "2024-08-30T21:00:00+02:00"
    },
    {
        "title": "Millors moments (temporada 5, setmana 1)",
        "urlArxiu": "https://audios.3catvideos.cat/multimedia/mp3/1/3/1725464422431.mp3",
        "urlPagina": "https://www.3cat.cat/3cat/millors-moments-setmana-1/audio/1217039/",
        "temporada": 5,
        "setmana": 1,
        "mida": 50390413,
        "durada_text": "00:52:29",
        "durada_ms": 3149000,
        "data_text": "06/09/2024 13:00",
        "data": "2024-09-06T13:00:00+02:00"
    },
    {
        "title": "Millors moments (temporada 5, setmana 2)",
        "urlArxiu": "https://audios.3catvideos.cat/multimedia/mp3/9/7/1725961526779.mp3",
        "urlPagina": "https://www.3cat.cat/3cat/millors-moments-setmana-2/audio/1217589/",
        "temporada": 5,
        "setmana": 2,
        "mida": 49905580,
        "durada_text": "00:51:59",
        "durada_ms": 3119000,
        "data_text": "13/09/2024 13:00",
        "data": "2024-09-13T13:00:00+02:00"
    },
    {
        "title": "Millors moments (temporada 5, setmana 3)",
        "urlArxiu": "https://audios.3catvideos.cat/multimedia/mp3/7/2/1726659922527.mp3",
        "urlPagina": "https://www.3cat.cat/3cat/millors-moments-setmana-3/audio/1218406/",
        "temporada": 5,
        "setmana": 3,
        "mida": 50474840,
        "durada_text": "00:52:34",
        "durada_ms": 3154000,
        "data_text": "20/09/2024 13:00",
        "data": "2024-09-20T13:00:00+02:00"
    },
    {
        "title": "Millors moments (temporada 5, setmana 4)",
        "urlArxiu": "https://audios.3catvideos.cat/multimedia/mp3/6/0/1727258160506.mp3",
        "urlPagina": "https://www.3cat.cat/3cat/millors-moments-setmana-4/audio/1219140/",
        "temporada": 5,
        "setmana": 4,
        "mida": 49836617,
        "durada_text": "00:51:54",
        "durada_ms": 3114000,
        "data_text": "27/09/2024 13:00",
        "data": "2024-09-27T13:00:00+02:00"
    },
    {
        "title": "Millors moments (temporada 5, setmana 5)",
        "urlArxiu": "https://audios.3catvideos.cat/multimedia/mp3/2/3/1727863520032.mp3",
        "urlPagina": "https://www.3cat.cat/3cat/millors-moments-setmana-5/audio/1219887/",
        "temporada": 5,
        "setmana": 5,
        "mida": 50191046,
        "durada_text": "00:52:16",
        "durada_ms": 3136000,
        "data_text": "04/10/2024 13:00",
        "data": "2024-10-04T13:00:00+02:00"
    },
    {
        "title": "Millors moments (temporada 5, setmana 6)",
        "urlArxiu": "https://audios.3catvideos.cat/multimedia/mp3/6/2/1728485111626.mp3",
        "urlPagina": "https://www.3cat.cat/3cat/millors-moments-setmana-6/audio/1220737/",
        "temporada": 5,
        "setmana": 6,
        "mida": 49481769,
        "durada_text": "00:51:32",
        "durada_ms": 3092000,
        "data_text": "11/10/2024 13:00",
        "data": "2024-10-11T13:00:00+02:00"
    },
    {
        "title": "Millors moments (temporada 5, setmana 7)",
        "urlArxiu": "https://audios.3catvideos.cat/multimedia/mp3/6/6/1729077655566.mp3",
        "urlPagina": "https://www.3cat.cat/3cat/millors-moments-setmana-7/audio/1221450/",
        "temporada": 5,
        "setmana": 7,
        "mida": 49476336,
        "durada_text": "00:51:32",
        "durada_ms": 3092000,
        "data_text": "18/10/2024 13:00",
        "data": "2024-10-18T13:00:00+02:00"
    },
    {
        "title": "Millors moments (temporada 5, setmana 8)",
        "urlArxiu": "https://audios.3catvideos.cat/multimedia/mp3/9/9/1729694747699.mp3",
        "urlPagina": "https://www.3cat.cat/3cat/millors-moments-setmana-8/audio/1222218/",
        "temporada": 5,
        "setmana": 8,
        "mida": 49579154,
        "durada_text": "00:51:38",
        "durada_ms": 3098000,
        "data_text": "25/10/2024 13:00",
        "data": "2024-10-25T13:00:00+02:00"
    },
    {
        "title": "Millors moments (temporada 5, setmana 9)",
        "urlArxiu": "https://audios.3catvideos.cat/multimedia/mp3/1/8/1730285413981.mp3",
        "urlPagina": "https://www.3cat.cat/3cat/millors-moments-setmana-9/audio/1222944/",
        "temporada": 5,
        "setmana": 9,
        "mida": 50255412,
        "durada_text": "00:52:20",
        "durada_ms": 3140000,
        "data_text": "01/11/2024 13:00",
        "data": "2024-11-01T13:00:00+01:00"
    },
    {
        "title": "Millors moments (temporada 5, setmana 10)",
        "urlArxiu": "https://audios.3catvideos.cat/multimedia/mp3/4/4/1730887507044.mp3",
        "urlPagina": "https://www.3cat.cat/3cat/millors-moments-setmana-10/audio/1223639/",
        "temporada": 5,
        "setmana": 10,
        "mida": 50103693,
        "durada_text": "00:52:11",
        "durada_ms": 3131000,
        "data_text": "08/11/2024 13:00",
        "data": "2024-11-08T13:00:00+01:00"
    },
    {
        "title": "Millors moments (temporada 5, setmana 11)",
        "urlArxiu": "https://audios.3catvideos.cat/multimedia/mp3/7/4/1731515705247.mp3",
        "urlPagina": "https://www.3cat.cat/3cat/millors-moments-setmana-11/audio/1224456/",
        "temporada": 5,
        "setmana": 11,
        "mida": 49606739,
        "durada_text": "00:51:40",
        "durada_ms": 3100000,
        "data_text": "15/11/2024 13:00",
        "data": "2024-11-15T13:00:00+01:00"
    },
    {
        "title": "Millors moments (temporada 5, setmana 12)",
        "urlArxiu": "https://audios.3catvideos.cat/multimedia/mp3/3/7/1732097413573.mp3",
        "urlPagina": "https://www.3cat.cat/3cat/millors-moments-setmana-12/audio/1225165/",
        "temporada": 5,
        "setmana": 12,
        "mida": 50060225,
        "durada_text": "00:52:08",
        "durada_ms": 3128000,
        "data_text": "22/11/2024 13:00",
        "data": "2024-11-22T13:00:00+01:00"
    },
    {
        "title": "Millors moments (temporada 5, setmana 13)",
        "urlArxiu": "https://audios.3catvideos.cat/multimedia/mp3/8/6/1732706440168.mp3",
        "urlPagina": "https://www.3cat.cat/3cat/millors-moments-setmana-13/audio/1225981/",
        "temporada": 5,
        "setmana": 13,
        "mida": 50087392,
        "durada_text": "00:52:10",
        "durada_ms": 3130000,
        "data_text": "29/11/2024 13:00",
        "data": "2024-11-29T13:00:00+01:00"
    },
    {
        "title": "Millors moments (temporada 5, setmana 14)",
        "urlArxiu": "https://audios.3catvideos.cat/multimedia/mp3/3/4/1733227229743.mp3",
        "urlPagina": "https://www.3cat.cat/3cat/millors-moments-setmana-14/audio/1226644/",
        "temporada": 5,
        "setmana": 14,
        "mida": 49865874,
        "durada_text": "00:51:56",
        "durada_ms": 3116000,
        "data_text": "06/12/2024 13:00",
        "data": "2024-12-06T13:00:00+01:00"
    },
    {
        "title": "Millors moments (temporada 5, setmana 15)",
        "urlArxiu": "https://audios.3catvideos.cat/multimedia/mp3/2/9/1733845210492.mp3",
        "urlPagina": "https://www.3cat.cat/3cat/millors-moments-setmana-15/audio/1227425/",
        "temporada": 5,
        "setmana": 15,
        "mida": 49592111,
        "durada_text": "00:51:39",
        "durada_ms": 3099000,
        "data_text": "13/12/2024 13:00",
        "data": "2024-12-13T13:00:00+01:00"
    },
    {
        "title": "Millors moments (temporada 5, setmana 16)",
        "urlArxiu": "https://audios.3catvideos.cat/multimedia/mp3/3/0/1734539464503.mp3",
        "urlPagina": "https://www.3cat.cat/3cat/millors-moments-setmana-16/audio/1228346/",
        "temporada": 5,
        "setmana": 16,
        "mida": 50051448,
        "durada_text": "00:52:08",
        "durada_ms": 3128000,
        "data_text": "20/12/2024 13:00",
        "data": "2024-12-20T13:00:00+01:00"
    },
    {
        "title": "Millors moments (temporada 5, setmana 17)",
        "urlArxiu": "https://audios.3catvideos.cat/multimedia/mp3/3/1/1734710719113.mp3",
        "urlPagina": "https://www.3cat.cat/3cat/millors-moments-setmana-17/audio/1228680/",
        "temporada": 5,
        "setmana": 17,
        "mida": 49264013,
        "durada_text": "00:51:19",
        "durada_ms": 3079000,
        "data_text": "27/12/2024 13:00",
        "data": "2024-12-27T13:00:00+01:00"
    },
    {
        "title": "Millors moments (temporada 5, setmana 18)",
        "urlArxiu": "https://audios.3catvideos.cat/multimedia/mp3/5/3/1735554309235.mp3",
        "urlPagina": "https://www.3cat.cat/3cat/millors-moments-setmana-18/audio/1229428/",
        "temporada": 5,
        "setmana": 18,
        "mida": 48839366,
        "durada_text": "00:50:52",
        "durada_ms": 3052000,
        "data_text": "03/01/2025 13:00",
        "data": "2025-01-03T13:00:00+01:00"
    },
    {
        "title": "Millors moments (temporada 5, setmana 19)",
        "urlArxiu": "https://audios.3catvideos.cat/multimedia/mp3/7/9/1736339738897.mp3",
        "urlPagina": "https://www.3cat.cat/3cat/millors-moments-setmana-19/audio/1230265/",
        "temporada": 5,
        "setmana": 19,
        "mida": 50173910,
        "durada_text": "00:52:15",
        "durada_ms": 3135000,
        "data_text": "10/01/2025 06:00",
        "data": "2025-01-10T06:00:00+01:00"
    },
    {
        "title": "Millors moments (temporada 5, setmana 20)",
        "urlArxiu": "https://audios.3catvideos.cat/multimedia/mp3/2/9/1736945721192.mp3",
        "urlPagina": "https://www.3cat.cat/3cat/millors-moments-setmana-20/audio/1231061/",
        "temporada": 5,
        "setmana": 20,
        "mida": 50028460,
        "durada_text": "00:52:06",
        "durada_ms": 3126000,
        "data_text": "17/01/2025 06:00",
        "data": "2025-01-17T06:00:00+01:00"
    },
    {
        "title": "Millors moments (temporada 5, setmana 21)",
        "urlArxiu": "https://audios.3catvideos.cat/multimedia/mp3/8/8/1737551773188.mp3",
        "urlPagina": "https://www.3cat.cat/3cat/millors-moments-setmana-21/audio/1232134/",
        "temporada": 5,
        "setmana": 21,
        "mida": 50199823,
        "durada_text": "00:52:17",
        "durada_ms": 3137000,
        "data_text": "24/01/2025 13:00",
        "data": "2025-01-24T13:00:00+01:00"
    },
    {
        "title": "Millors moments (temporada 5, setmana 22)",
        "urlArxiu": "https://audios.3catvideos.cat/multimedia/mp3/6/4/1738065327846.mp3",
        "urlPagina": "https://www.3cat.cat/3cat/millors-moments-setmana-22/audio/1232822/",
        "temporada": 5,
        "setmana": 22,
        "mida": 50283415,
        "durada_text": "00:52:22",
        "durada_ms": 3142000,
        "data_text": "31/01/2025 13:00",
        "data": "2025-01-31T13:00:00+01:00"
    },
    {
        "title": "Millors moments (temporada 5, setmana 23)",
        "urlArxiu": "https://audios.3catvideos.cat/multimedia/mp3/7/3/1738767022637.mp3",
        "urlPagina": "https://www.3cat.cat/3cat/millors-moments-setmana-23/audio/1233727/",
        "temporada": 5,
        "setmana": 23,
        "mida": 49777266,
        "durada_text": "00:51:51",
        "durada_ms": 3111000,
        "data_text": "07/02/2025 13:00",
        "data": "2025-02-07T13:00:00+01:00"
    },
    {
        "title": "Millors moments (temporada 5, setmana 24)",
        "urlArxiu": "https://audios.3catvideos.cat/multimedia/mp3/8/2/1739376030428.mp3",
        "urlPagina": "https://www.3cat.cat/3cat/millors-moments-setmana-24/audio/1234505/",
        "temporada": 5,
        "setmana": 24,
        "mida": 50363663,
        "durada_text": "00:52:27",
        "durada_ms": 3147000,
        "data_text": "14/02/2025 13:00",
        "data": "2025-02-14T13:00:00+01:00"
    },
    {
        "title": "Millors moments (temporada 5, setmana 25)",
        "urlArxiu": "https://audios.3catvideos.cat/multimedia/mp3/2/8/1739958040382.mp3",
        "urlPagina": "https://www.3cat.cat/3cat/millors-moments-setmana-25/audio/1235229/",
        "temporada": 5,
        "setmana": 25,
        "mida": 50082795,
        "durada_text": "00:52:10",
        "durada_ms": 3130000,
        "data_text": "21/02/2025 13:00",
        "data": "2025-02-21T13:00:00+01:00"
    },
    {
        "title": "Millors moments (temporada 5, setmana 26)",
        "urlArxiu": "https://audios.3catvideos.cat/multimedia/mp3/0/3/1740582953930.mp3",
        "urlPagina": "https://www.3cat.cat/3cat/millors-moments-setmana-26/audio/1236039/",
        "temporada": 5,
        "setmana": 26,
        "mida": 49588767,
        "durada_text": "00:51:39",
        "durada_ms": 3099000,
        "data_text": "28/02/2025 13:00",
        "data": "2025-02-28T13:00:00+01:00"
    },
    {
        "title": "Millors moments (temporada 5, setmana 27)",
        "urlArxiu": "https://audios.3catvideos.cat/multimedia/mp3/8/4/1741185332948.mp3",
        "urlPagina": "https://www.3cat.cat/3cat/millors-moments-setmana-27/audio/1236785/",
        "temporada": 5,
        "setmana": 27,
        "mida": 50130442,
        "durada_text": "00:52:13",
        "durada_ms": 3133000,
        "data_text": "07/03/2025 13:00",
        "data": "2025-03-07T13:00:00+01:00"
    },
    {
        "title": "Millors moments (temporada 5, setmana 28)",
        "urlArxiu": "https://audios.3catvideos.cat/multimedia/mp3/6/7/1741778748076.mp3",
        "urlPagina": "https://www.3cat.cat/3cat/millors-moments-setmana-28/audio/1237532/",
        "temporada": 5,
        "setmana": 28,
        "mida": 50148832,
        "durada_text": "00:52:14",
        "durada_ms": 3134000,
        "data_text": "14/03/2025 13:00",
        "data": "2025-03-14T13:00:00+01:00"
    },
    {
        "title": "Millors moments (temporada 5, setmana 29)",
        "urlArxiu": "https://audios.3catvideos.cat/multimedia/mp3/1/9/1742385667191.mp3",
        "urlPagina": "https://www.3cat.cat/3cat/millors-moments-setmana-29/audio/1238301/",
        "temporada": 5,
        "setmana": 29,
        "mida": 50084049,
        "durada_text": "00:52:10",
        "durada_ms": 3130000,
        "data_text": "21/03/2025 13:00",
        "data": "2025-03-21T13:00:00+01:00"
    },
    {
        "title": "Millors moments (temporada 5, setmana 30)",
        "urlArxiu": "https://audios.3catvideos.cat/multimedia/mp3/6/4/1742989235046.mp3",
        "urlPagina": "https://www.3cat.cat/3cat/millors-moments-setmana-30/audio/1239077/",
        "temporada": 5,
        "setmana": 30,
        "mida": 49806524,
        "durada_text": "00:51:52",
        "durada_ms": 3112000,
        "data_text": "28/03/2025 13:00",
        "data": "2025-03-28T13:00:00+01:00"
    },
    {
        "title": "Millors moments (temporada 5, setmana 31)",
        "urlArxiu": "https://audios.3catvideos.cat/multimedia/mp3/7/9/1743597063997.mp3",
        "urlPagina": "https://www.3cat.cat/3cat/millors-moments-setmana-31/audio/1239845/",
        "temporada": 5,
        "setmana": 31,
        "mida": 50419252,
        "durada_text": "00:52:31",
        "durada_ms": 3151000,
        "data_text": "04/04/2025 13:00",
        "data": "2025-04-04T13:00:00+02:00"
    },
    {
        "title": "Millors moments (temporada 5, setmana 32)",
        "urlArxiu": "https://audios.3catvideos.cat/multimedia/mp3/6/7/1744281948576.mp3",
        "urlPagina": "https://www.3cat.cat/3cat/millors-moments-semana-32/audio/1240753/",
        "temporada": 5,
        "setmana": 32,
        "mida": 50315180,
        "durada_text": "00:52:24",
        "durada_ms": 3144000,
        "data_text": "11/04/2025 13:00",
        "data": "2025-04-11T13:00:00+02:00"
    },
    {
        "title": "Millors moments (temporada 5, setmana 33)",
        "urlArxiu": "https://audios.3catvideos.cat/multimedia/mp3/4/6/1744644667964.mp3",
        "urlPagina": "https://www.3cat.cat/3cat/millors-moments-setmana-33/audio/1241182/",
        "temporada": 5,
        "setmana": 33,
        "mida": 50021355,
        "durada_text": "00:52:06",
        "durada_ms": 3126000,
        "data_text": "18/04/2025 13:00",
        "data": "2025-04-18T13:00:00+02:00"
    },
    {
        "title": "Millors moments (temporada 5, setmana 34)",
        "urlArxiu": "https://audios.3catvideos.cat/multimedia/mp3/4/9/1745938827394.mp3",
        "urlPagina": "https://www.3cat.cat/3cat/millors-moments-setmana-34/audio/1242761/",
        "temporada": 5,
        "setmana": 34,
        "mida": 49908924,
        "durada_text": "00:51:59",
        "durada_ms": 3119000,
        "data_text": "25/04/2025 13:00",
        "data": "2025-04-25T13:00:00+02:00"
    },
    {
        "title": "Millors moments (temporada 5, setmana 35)",
        "urlArxiu": "https://audios.3catvideos.cat/multimedia/mp3/5/0/1746003310205.mp3",
        "urlPagina": "https://www.3cat.cat/3cat/millors-moments-setmana-35/audio/1242844/",
        "temporada": 5,
        "setmana": 35,
        "mida": 49632235,
        "durada_text": "00:51:42",
        "durada_ms": 3102000,
        "data_text": "02/05/2025 13:00",
        "data": "2025-05-02T13:00:00+02:00"
    },
    {
        "title": "Millors moments (temporada 5, setmana 36)",
        "urlArxiu": "https://audios.3catvideos.cat/multimedia/mp3/7/2/1746616213927.mp3",
        "urlPagina": "https://www.3cat.cat/3cat/millors-moments-setmana-36/audio/1243570/",
        "temporada": 5,
        "setmana": 36,
        "mida": 50296790,
        "durada_text": "00:52:23",
        "durada_ms": 3143000,
        "data_text": "09/05/2025 13:00",
        "data": "2025-05-09T13:00:00+02:00"
    },
    {
        "title": "Millors moments (temporada 5, setmana 37)",
        "urlArxiu": "https://audios.3catvideos.cat/multimedia/mp3/6/3/1747216861036.mp3",
        "urlPagina": "https://www.3cat.cat/3cat/millors-moments-setmana-37/audio/1244317/",
        "temporada": 5,
        "setmana": 37,
        "mida": 50048940,
        "durada_text": "00:52:08",
        "durada_ms": 3128000,
        "data_text": "16/05/2025 13:00",
        "data": "2025-05-16T13:00:00+02:00"
    },
    {
        "title": "Millors moments (temporada 5, setmana 38)",
        "urlArxiu": "https://audios.3catvideos.cat/multimedia/mp3/7/4/1747829727147.mp3",
        "urlPagina": "https://www.3cat.cat/3cat/millors-moments-setmana-38/audio/1245126/",
        "temporada": 5,
        "setmana": 38,
        "mida": 50150922,
        "durada_text": "00:52:14",
        "durada_ms": 3134000,
        "data_text": "23/05/2025 13:00",
        "data": "2025-05-23T13:00:00+02:00"
    },
    {
        "title": "Millors moments (temporada 5, setmana 39)",
        "urlArxiu": "https://audios.3catvideos.cat/multimedia/mp3/3/0/1748519108803.mp3",
        "urlPagina": "https://www.3cat.cat/3cat/millors-moments-setmana-39/audio/1246015/",
        "temporada": 5,
        "setmana": 39,
        "mida": 50035983,
        "durada_text": "00:52:07",
        "durada_ms": 3127000,
        "data_text": "30/05/2025 13:00",
        "data": "2025-05-30T13:00:00+02:00"
    },
    {
        "title": "Millors moments (temporada 5, setmana 40)",
        "urlArxiu": "https://audios.3catvideos.cat/multimedia/mp3/6/3/1749033612636.mp3",
        "urlPagina": "https://www.3cat.cat/3cat/millors-moments-setmana-40/audio/1246642/",
        "temporada": 5,
        "setmana": 40,
        "mida": 49716244,
        "durada_text": "00:51:47",
        "durada_ms": 3107000,
        "data_text": "06/06/2025 13:00",
        "data": "2025-06-06T13:00:00+02:00"
    },
    {
        "title": "Millors moments (temporada 5, setmana 41)",
        "urlArxiu": "https://audios.3catvideos.cat/multimedia/mp3/8/5/1749570661658.mp3",
        "urlPagina": "https://www.3cat.cat/3cat/millors-moments-setmana-41/audio/1247276/",
        "temporada": 5,
        "setmana": 41,
        "mida": 50586853,
        "durada_text": "00:52:41",
        "durada_ms": 3161000,
        "data_text": "13/06/2025 13:00",
        "data": "2025-06-13T13:00:00+02:00"
    },
    {
        "title": "Millors moments (temporada 5, setmana 42)",
        "urlArxiu": "https://audios.3catvideos.cat/multimedia/mp3/3/0/1750233339903.mp3",
        "urlPagina": "https://www.3cat.cat/3cat/millors-moments-setmana-42/audio/1248101/",
        "temporada": 5,
        "setmana": 42,
        "mida": 50225319,
        "durada_text": "00:52:19",
        "durada_ms": 3139000,
        "data_text": "20/06/2025 13:00",
        "data": "2025-06-20T13:00:00+02:00"
    },
    {
        "title": "Millors moments (temporada 5, setmana 43)",
        "urlArxiu": "https://audios.3catvideos.cat/multimedia/mp3/6/8/1750865164286.mp3",
        "urlPagina": "https://www.3cat.cat/3cat/millors-moments-setmana-43/audio/1248829/",
        "temporada": 5,
        "setmana": 43,
        "mida": 49170390,
        "durada_text": "00:51:13",
        "durada_ms": 3073000,
        "data_text": "27/06/2025 13:00",
        "data": "2025-06-27T13:00:00+02:00"
    },
    {
        "title": "Millors moments (temporada 5, setmana 44)",
        "urlArxiu": "https://audios.3catvideos.cat/multimedia/mp3/1/0/1751451012701.mp3",
        "urlPagina": "https://www.3cat.cat/3cat/millors-moments-setmana-44/audio/1249534/",
        "temporada": 5,
        "setmana": 44,
        "mida": 50166386,
        "durada_text": "00:52:15",
        "durada_ms": 3135000,
        "data_text": "04/07/2025 13:00",
        "data": "2025-07-04T13:00:00+02:00"
    }
]
